impound_no,Animal_ID,Data_Source,Record_Type,Link,Current_Location,Animal_Name,animal_type,Age,Animal_Gender,Animal_Breed,Animal_Color,Date,Date_Type,Obfuscated_Address,City,State,Zip,jurisdiction,obfuscated_latitude,obfuscated_longitude,Image,image_alt_text,Memo,TemperamentK19-117280,A585073,Regional Animal Services of King County,LOST,https://petharbor.com/PublicDetail.asp?searchtype=PUBFOUND&view=sysadm.v_animal&shelterlist='KING'&where=type&ID=1992721,LOST,Letche,Cat,Under 1 year,Male,Domestic Mediumhair,Unknown,5/12/19 0:00,Date Lost,COOPERS CORNER,,,,JURISDICTION,,,https://petharbor.com/get_image.asp?RES=Detail&LOCATION=PUBLIC&ID=1992721,Image Copyright HLP Inc. 2019,Description: All white cat with large brown/tan spot on top of head.  3 dark spots going down the tail.  Blue eyes.  No collar.<p/>Age: Under 1 year<p/>Location Lost: Coopers Corner<p/>Notes: <p/>Lost Date: 05/12/2019<p/>,K17-102943,A538943,Regional Animal Services of King County,ADOPTABLE,https://kingcounty.gov/depts/regional-animal-services/about-us/overview.aspx,In RASKC Foster Home,Anastasia,Cat,9 YEARS 7 MONTHS,Spayed Female,Domestic Longhair,Black,9/17/17 0:00,Received on,21615 64TH AVE S,KENT,WA,98032,KENT,47.407788,-122.255197,https://petharbor.com/get_image.asp?RES=Detail&LOCATION=KING&ID=A538943,Image Copyright HLP Inc. 2019,"Received on: 2017-09-17<p/> Description: Black Spayed Female Domestic Longhair Cat<p/> Age: 9 YEARS 7 MONTHS<p/> Adoption Fee: $30.00<p/> Current Location: In RASKC Foster Home <p/>Hi! My name is Anastasia and I am available for adoption.<p/><p/>I was brought in by a good samaritan on September 17, 2017.<p/><p/>I am an independent kitty who likes to do my own thing! I like getting attention on my own terms. I can get overstimulated with petting, so please move carefully with me and keep an eye out for signs that I might need a break.<p/><p/>My caregivers have noticed that I do not seem to get along with other cats, so I may do best as the only cat in my new home.<p/><p/>My personality color is GREEN. I am an adaptable cat who loves to go with the flow! I am outgoing and carefree, and I just can't wait to find my forever home!<p/><p/>A veterinarian has diagnosed or tentatively diagnosed the above-described pet with the following condition(s):<p/><p/>1)   Renal disease.  Anastasia has been documented to have renal insufficiency characterized by increased renal values and the inability to concentrate urine.  She has increase thirst and increased urine production.  Renal disease is generally progressive and must be managed to maintain a good quality of life.  Your veterinarian may recommend additional testing, medications, prescription diets, or supplemental care as needed.<p/><p/>2)  Old fracture of left femoral head and left ilium.  Spondylosis in thoracolumbar area.  She has had some stiffness in the hind end.  These chronic changes can be managed with pain medication and joint supplements.  Treatment is focused on lifelong management of the disease, rather than a cure.  Treatment may include weight loss plans, daily medications, nutritional supplements or regular, moderate exercise.  Please follow up with your regular veterinarian.<p/><p/>3)  Radiographic evidence of bronchopulmonary disease/asthma.  No respiratoyr signs have been noted but she may need treatment in the future.<p/><p/>As a result of these conditions, your pet may need specialized care consisting of any or all of the below.  Please note this is not intended to be an exhaustive list.<p/><p/>- Special diet or prescription foods<p/>- Prescription or over-the-counter medicines<p/>- Special skin care or shampoos<p/>- Regular veterinarian visits, which may include blood tests or other monitoring<p/>- Possible surgery or other procedures as determined by your veterinarian<p/><p/>",K17-104325,A533907,Regional Animal Services of King County,ADOPTABLE,https://kingcounty.gov/depts/regional-animal-services/about-us/overview.aspx,In RASKC Foster Home,Hera,Cat,11 YEARS -1 MONTHS,Spayed Female,Domestic Shorthair,Calico,10/28/17 0:00,Received on,21615 64TH AVE S,KENT,WA,98032,SEATTLE,47.407788,-122.255197,https://petharbor.com/get_image.asp?RES=Detail&LOCATION=KING&ID=A533907,Image Copyright HLP Inc. 2019,"Received on: 2017-10-28<p/> Description: Calico Spayed Female Domestic Shorthair Cat<p/> Age: 11 YEARS -1 MONTHS<p/> Adoption Fee: An Adoption Fee has not been set. Please inquire with the shelter.<p/> Current Location: In RASKC Foster Home <p/>My name is Hera and I am an 11 year old calico, short haired, spayed female cat. I ended up at the shelter through no fault of my own and now I am looking for a forever home.<p/><p/>I am a very sweet and friendly girl.  I love, love, love attention and will come to seek you out.  I get along well with other cats, even when they get in my face, I still stay chill. I love to be petted and brushed too.<p/><p/>I am litterbox trained, have all my vaccinations and I'm microchipped, so I will not get lost again.  I am an easy going girl who really just wants to find my forever friend.  Please come to see me, you won't be disappointed.<p/><p/>A veterinarian has diagnosed or tentatively diagnosed the above-described pet with the following condition(s):<p/><p/>1)     Hera has been diagnosed with hyperthyroidism; excess production of thyroid hormone.  Hyperthyroidism can cause weight loss, vocalization, increased urine production and heart disease.  This condition is being managed with daily medication.  Other treatment options may be available, including radioactive iodine treatment or prescription diet.  Periodic blood testing to monitor thyroid levels is needed.  Please follow up with you regular veterinarian to create a treatment plan.  An educational handout is provided.<p/><p/>2)     Hera has had mild recurring upper respiratory infections.<p/><p/><p/>As a result of these conditions, your pet may need specialized care consisting of any or all of the below.  Please note this is not intended to be an exhaustive list.<p/><p/>- Special diet or prescription foods<p/>- Prescription or over-the-counter medicines<p/>- Special skin care or shampoos<p/>- Regular veterinarian visits, which may include blood tests or other monitoring<p/>- Possible surgery or other procedures as determined by your veterinarian<p/><p/>",K17-105331,A547918,Regional Animal Services of King County,ADOPTABLE,https://kingcounty.gov/depts/regional-animal-services/about-us/overview.aspx,In RASKC Foster Home,Babette,Cat,18 YEARS 5 MONTHS,Spayed Female,Domestic Shorthair,Brn Tabby,12/4/17 0:00,Received on,21615 64TH AVE S,KENT,WA,98032,KING COUNTY,47.407788,-122.255197,https://petharbor.com/get_image.asp?RES=Detail&LOCATION=KING&ID=A547918,Image Copyright HLP Inc. 2019,"Received on: 2017-12-04<p/> Description: Brn Tabby Spayed Female Domestic Shorthair Cat<p/> Age: 18 YEARS 5 MONTHS<p/> Adoption Fee: $30.00<p/> Current Location: In RASKC Foster Home <p/>Hi! My name is Babette and I am available for adoption.<p/><p/>I was brought in by my previous owner on 12/5/17 because the landlord didn't allow cats. I lived in a home with dogs but the were not my favorite. I also lived with other cats and children. My previous owner described me as calm and vocal.<p/><p/>I like getting attention on my own terms. I can get overstimulated with petting, so please move carefully with me and keep an eye out for signs that I might need a break.<p/><p/>Because of my shy nature, I would do best in a calm, quiet home.<p/><p/>My personality color is BLUE. I am a gentle and loving cat who likes to take things slow. I may get nervous in new situations, so I am looking for a family who understands that I might need some time to warm up. Once I get to know you, I will be a very devoted friend!<p/><p/>A veterinarian has diagnosed or tentatively diagnosed the above-described pet with the following condition(s):<p/><p/>1)     This animal has been diagnosed as hyperthyroid.  This means that thyroid gland is producing an excess of hormones.  This disease can be easily managed with daily medication, radioactive iodine treatment or prescription diet.  Please follow up with you regular veterinarian to create a treatment plan.  We have also included a handout with more information about this disease.<p/><p/>2)  This animal has been diagnosed with early kidney disease.  This condition can be managed with special diets and medications.  Treatment will be lifelong.  Please follow up with your regular veterinarian for the best treatment plan.  <p/><p/><p/>As a result of these conditions, your pet may need specialized care consisting of any or all of the below.  Please note this is not intended to be an exhaustive list.<p/><p/>- Special diet or prescription foods<p/>- Prescription or over-the-counter medicines<p/>- Special skin care or shampoos<p/>- Regular veterinarian visits, which may include blood tests or other monitoring<p/>- Possible surgery or other procedures as determined by your veterinarian<p/><p/><p/>",BLUEK18-106401,A551273,Regional Animal Services of King County,ADOPTABLE,https://kingcounty.gov/depts/regional-animal-services/about-us/overview.aspx,In RASKC Foster Home,Midnight,Cat,13 YEARS 3 MONTHS,Spayed Female,Domestic Shorthair,Black,2/3/18 0:00,Received on,21615 64TH AVE S,KENT,WA,98032,KING COUNTY,47.407788,-122.255197,https://petharbor.com/get_image.asp?RES=Detail&LOCATION=KING&ID=A551273,Image Copyright HLP Inc. 2019,"Received on: 2018-02-03<p/> Description: Black Spayed Female Domestic Shorthair Cat<p/> Age: 13 YEARS 3 MONTHS<p/> Adoption Fee: $30.00<p/> Current Location: In RASKC Foster Home <p/>Hi! My name is Midnight and I am available for adoption.<p/><p/>I was brought in by my previous owner on  2/3/18.<p/><p/><p/>My personality color is GREEN. I am an adaptable cat who loves to go with the flow! I am outgoing and carefree, and I just can't wait to find my forever home!<p/><p/>I am an affectionate lovebug who would be thrilled to cuddle up with you at home!<p/><p/><p/>My caregivers have noticed that I seem to do well with other cats. When meeting cats in a new home, I would do best with a slow introduction.<p/><p/><p/><p/><p/>",GREENK18-109705,A561461,Regional Animal Services of King County,ADOPTABLE,https://kingcounty.gov/depts/regional-animal-services/about-us/overview.aspx,In RASKC Foster Home,Baby Girl,Cat,14 YEARS 10 MONTHS,Spayed Female,Domestic Shorthair,Seal Pt,6/26/18 0:00,Received on,21615 64TH AVE S,KENT,WA,98032,COVINGTON,47.407788,-122.255197,https://petharbor.com/get_image.asp?RES=Detail&LOCATION=KING&ID=A561461,Image Copyright HLP Inc. 2019,"Received on: 2018-06-26<p/> Description: Seal Pt Spayed Female Domestic Shorthair Cat<p/> Age: 14 YEARS 10 MONTHS<p/> Adoption Fee: $30.00<p/> Current Location: In RASKC Foster Home <p/>Hi! My name is Baby Girl and I am available for adoption.<p/><p/>I was brought in by my previous owner on 6/26/18 because they couldnt take care of me anymore. My previous owner described me as friendly, active, playful and vocal.<p/><p/>I do love to talk! I would love to tell you all about how my day is going!<p/>I am an affectionate lovebug who would be thrilled to cuddle up with you at home!<p/><p/>My personality color is GREEN. I am an adaptable cat who loves to go with the flow! I am outgoing and carefree, and I just can't wait to find my forever home!<p/><p/><p/>",GREENK18-110899,A564655,Regional Animal Services of King County,ADOPTABLE,https://kingcounty.gov/depts/regional-animal-services/about-us/overview.aspx,In RASKC Foster Home,Checkers,Cat,14 YEARS 9 MONTHS,Spayed Female,Domestic Shorthair,Black / White,8/2/18 0:00,Received on,21615 64TH AVE S,KENT,WA,98032,KING COUNTY,47.407788,-122.255197,https://petharbor.com/get_image.asp?RES=Detail&LOCATION=KING&ID=A564655,Image Copyright HLP Inc. 2019,"Received on: 2018-08-02<p/> Description: Black / White Spayed Female Domestic Shorthair Cat<p/> Age: 14 YEARS 9 MONTHS<p/> Adoption Fee: $30.00<p/> Current Location: In RASKC Foster Home <p/>Hi! My name is Checkers and I am available for adoption.<p/><p/>I was brought in by my previous owner on August 2nd, 2018 because they were moving and could not keep me. My previous owner described me as friendly and sweet. They also said that I like to hang out in windows and watch birds, lay on your lap and that I'm not a big fan of being picked up. <p/><p/>My personality color is red.  I enjoy getting pets on the head most and I like sitting on your lap after I get to know you!  <p/><p/>My caregivers have noticed I do not like other cats.  I prefer to be the only princess in the house!<p/><p/>",REDK18-111651,A566749,Regional Animal Services of King County,ADOPTABLE,https://kingcounty.gov/depts/regional-animal-services/about-us/overview.aspx,In RASKC Foster Home,Rosie,Cat,13 YEARS 8 MONTHS,Female,Domestic Shorthair,Calico / Tortie,8/27/18 0:00,Received on,21615 64TH AVE S,KENT,WA,98032,KENT,47.407788,-122.255197,https://petharbor.com/get_image.asp?RES=Detail&LOCATION=KING&ID=A566749,Image Copyright HLP Inc. 2019,"Received on: 2018-08-27<p/> Description: Calico / Tortie Female Domestic Shorthair Cat<p/> Age: 13 YEARS 8 MONTHS<p/> Adoption Fee: $30.0<p/> Current Location: In RASKC Foster Home <p/>Hi! My name is Rosie and I am available for adoption.<p/><p/>I was brought in by a good samaritan on 8/27/18.<p/><p/>My personality color is GREEN. I am an adaptable cat who loves to go with the flow! I am outgoing and carefree, and I just can't wait to find my forever home!<p/><p/>I am an affectionate lovebug who would be thrilled to cuddle up with you at home!<p/><p/><p/>",GREENK19-114789,A578201,Regional Animal Services of King County,ADOPTABLE,https://kingcounty.gov/depts/regional-animal-services/about-us/overview.aspx,In RASKC Foster Home,Karl,Cat,12 YEARS 4 MONTHS,Male,Domestic Longhair,Brn Tabby,1/11/19 0:00,Received on,21615 64TH AVE S,KENT,WA,98032,TUKWILA,47.407788,-122.255197,https://petharbor.com/get_image.asp?RES=Detail&LOCATION=KING&ID=A578201,Image Copyright HLP Inc. 2019,"Received on: 2019-01-11<p/> Description: Brn Tabby Male Domestic Longhair Cat<p/> Age: 12 YEARS 4 MONTHS<p/> Adoption Fee: An Adoption Fee has not been set. Please inquire with the shelter.<p/> Current Location: In RASKC Foster Home <p/>Karl is a big guy with a matching cattitude. He would be best as the only pet in the house unless he could get a proper (and long) introduction, as he thinks he is the alpha male. In foster care he tolerates three other cats that are all submissive. He was traumatized by the death of his owner when he was brought in to RASKC, and after two months in foster care he has settled down quite a bit. Sometimes he will jump up on your lap, headbutt you and purr, and a few minutes later hiss and jump down. At this time he needs a forever home with lots of attention so he can settle into being a happy cat all of the time. Note that it has taken several weeks to get to where he is now and will likely regress some when he moves. It will require some patience but it will be well worth it as he can be a big, loving and cuddly kitty. He'll even sleep under the covers with you.<p/><p/>Karl is not a picky eater and is 100% when it comes to the litter box. He marks his ""territory"" with a headbutt only and does not spray (whew!). He loves his cardboard scratching post and is absolutely crazy about catnip and his catnip banana. A laser pointer is a must as is a feather on a string for play. He is an exclusively inside cat but does like to spend some time in the catio to get away.<p/><p/>You can meet Karl at his foster home and have any of your questions answered.<p/>",REDK19-115007,A578798,Regional Animal Services of King County,ADOPTABLE,https://kingcounty.gov/depts/regional-animal-services/about-us/overview.aspx,In RASKC Foster Home,Mcgonagall,Cat,9 MONTHS,Spayed Female,Domestic Shorthair,Brn Tabby / White,1/22/19 0:00,Received on,21615 64TH AVE S,KENT,WA,98032,KING COUNTY,47.407788,-122.255197,https://petharbor.com/get_image.asp?RES=Detail&LOCATION=KING&ID=A578798,Image Copyright HLP Inc. 2019,"Received on: 2019-01-22<p/> Description: Brn Tabby / White Spayed Female Domestic Shorthair Cat<p/> Age: 9 MONTHS<p/> Adoption Fee: An Adoption Fee has not been set. Please inquire with the shelter.<p/> Current Location: In RASKC Foster Home <p/>McGonagall is still very timid to strangers. However once she gets to know you she will beg you for attention. Definitely shows her age in the amount of energy she has. She plays with many things whether intended for her or not ??. Her sweet spot is right behind her ears and her jaw line especially, pet there a few times and she will literally melt in your hands!<p/><p/>Please contact the foster mom Casey at 505-577-2119<p/>",BLUEK19-115394,A574900,Regional Animal Services of King County,ADOPTABLE,https://kingcounty.gov/depts/regional-animal-services/about-us/overview.aspx,In RASKC Foster Home,Ember,Cat,12 YEARS 5 MONTHS,Neutered Male,Domestic Shorthair,Gray / White,2/16/19 0:00,Received on,21615 64TH AVE S,KENT,WA,98032,KENT,47.407788,-122.255197,https://petharbor.com/get_image.asp?RES=Detail&LOCATION=KING&ID=A574900,Image Copyright HLP Inc. 2019,"Received on: 2019-02-16<p/> Description: Gray / White Neutered Male Domestic Shorthair Cat<p/> Age: 12 YEARS 5 MONTHS<p/> Adoption Fee: $30.00<p/> Current Location: In RASKC Foster Home <p/>Hi! My name is Ember and I am available for adoption.<p/><p/>I was brought in by a good samaritan on 11/16/18.<p/><p/>My personality color is GREEN. I am an adaptable cat who loves to go with the flow! I am outgoing and carefree, and I just can't wait to find my forever home!<p/><p/>I am an affectionate lovebug who would be thrilled to cuddle up with you at home!<p/><p/>My caregivers have noticed that I seem to do well with other cats. When meeting cats in a new home, I would do best with a slow introduction.<p/><p/>",GREENK19-115456,A579958,Regional Animal Services of King County,ADOPTABLE,https://kingcounty.gov/depts/regional-animal-services/about-us/overview.aspx,In RASKC Foster Home,Brina,Cat,12 YEARS 2 MONTHS,Spayed Female,Domestic Shorthair,Calico,2/20/19 0:00,Received on,21615 64TH AVE S,KENT,WA,98032,KING COUNTY,47.407788,-122.255197,https://petharbor.com/get_image.asp?RES=Detail&LOCATION=KING&ID=A579958,Image Copyright HLP Inc. 2019,"Received on: 2019-02-20<p/> Description: Calico Spayed Female Domestic Shorthair Cat<p/> Age: 12 YEARS 2 MONTHS<p/> Adoption Fee: $30.00<p/> Current Location: In RASKC Foster Home <p/>Hi! My name is Brina and I am available for adoption.<p/><p/>I was brought in by a good samaritan on 02/20/19.<p/><p/>My personality color is BLUE. I am a gentle and loving cat who likes to take things slow. I may get nervous in new situations, so I am looking for a family who understands that I might need some time to warm up. Once I get to know you, I will be a very devoted friend!<p/><p/>",BLUEK19-115473,A564257,Regional Animal Services of King County,ADOPTABLE,https://petharbor.com/pet.asp?uaid=KING.A564257,"King County Pet Adoption Center 21615 64TH AVE S KENT, WA 98032",Buster,Dog,4 YEARS 9 MONTHS,Neutered Male,Pit Bull / Mix,Br Brindle / White,2/21/19 0:00,Received on,,,,,,,,https://petharbor.com/get_image.asp?RES=Detail&LOCATION=KING&ID=A564257,Image Copyright HLP Inc. 2019,"Received on: 2019-02-21<p/> Description: Br Brindle / White<p/>  Neutered Male Pit Bull / Mix Dog<p/> Age: 4 YEARS 9 MONTHS<p/> Adoption Fee: $100.00<p/> Current Location: King County Pet Adoption Center 21615 64TH AVE S KENT, WA 98032<p/>Hi! My name is Buster and I am available for adoption. I was brought in by my previous owner on 2/21/19 because I did not enjoy living with another dog. <p/><p/>I am an energetic guy who would love to be your hiking partner! I would also make a great cuddle buddy and I just adore belly rubs! I love my favorite people so much that I sometimes display separation anxiety, but I do feel safe if kept crated when I'm left alone.<p/><p/>I am a very smart dog and I already know ""sit,"" ""stay,"" ""come,"" ""down"" and ""shake."" I am still working on my manners, so I would so best with a family who can work with me and help me become the best dog I can be. <p/><p/>My caregivers have observed that I might not get along with other dogs. I may do best as the only dog in my new home, or need to meet other dogs in the home first. I also may do best in a home without children.<p/><p/>My personality color is RED, meaning I am a spirited dog with a fun-loving personality! I am still working on my manners, so I would do best with a family who is willing to work with me and help me become the best dog I can be!<p/>",REDK19-115994,A577657,Regional Animal Services of King County,ADOPTABLE,https://petharbor.com/pet.asp?uaid=KING.A577657,"King County Pet Adoption Center 21615 64TH AVE S KENT, WA 98032",Franco,Dog,6 YEARS 4 MONTHS,Neutered Male,American Bulldog / Mix,Tan / White,3/22/19 0:00,Received on,,,,,,,,https://petharbor.com/get_image.asp?RES=Detail&LOCATION=KING&ID=A577657,Image Copyright HLP Inc. 2019,"Received on: 2019-03-22<p/> Description: Tan / White<p/>  Neutered Male American Bulldog / Mix Dog<p/> Age: 6 YEARS 4 MONTHS<p/> Adoption Fee: $100.00<p/> Current Location: King County Pet Adoption Center 21615 64TH AVE S KENT, WA 98032<p/>Hi! My name is Franco and I am available for adoption.<p/><p/>I was brought in by my previous adopter on March 22, 2019 because I was not a good fit for a home with cats. My previous owner described me as happy and affectionate! They said I liked long walks and snuggling on the couch, but I can also be stubborn sometimes.<p/><p/>I am an affectionate lovebug who would be thrilled to cuddle up with you at home!<p/><p/>I am full of energy and I love to play! I tend to calm down more when the people around me stay calm. I do best when I have lots of exercise and something to keep my mind busy.<p/><p/>My personality color is RED. I am a spirited dog with a fun-loving personality! I am still working on my manners, so I would do best with a family who is willing to work with me and help me become the best dog I can be!<p/>",REDK19-116317,A497023,Regional Animal Services of King County,ADOPTABLE,https://petharbor.com/pet.asp?uaid=KING.A497023,"Kirkland Petco 12040 NE 85TH ST KIRKLAND, WA 98033",Sasha,Cat,8 YEARS 11 MONTHS,Spayed Female,Domestic Longhair,Tortie / Gray,4/6/19 0:00,Received on,12040 NE 85TH ST,KIRKLAND,WA,98033,KIRKLAND,47.680519,-122.179195,https://petharbor.com/get_image.asp?RES=Detail&LOCATION=KING&ID=A497023,Image Copyright HLP Inc. 2019,"Received on: 2019-04-06<p/> Description: Tortie / Gray<p/>  Spayed Female Domestic Longhair Cat<p/> Age: 8 YEARS 11 MONTHS<p/> Adoption Fee: $30.00<p/> Current Location: Kirkland Petco 12040 NE 85TH ST KIRKLAND, WA 98033<p/>Hi! My name is Sasha and I am available for adoption. I was brought in by my previous owner on 4/6/19.  They said I am a sweet cat that likes to be petted and get belly rubs.<p/><p/>My caregivers have noticed that I do not seem to get along with other cats. I may do best as the only pet in the home. <p/><p/>I can be picky about my litter box and I prefer to have wheat litter in an extra large litter box with high sides. I also prefer to have my litter box in a quiet area with daily cleaning. I do best when I do not have the opportunity to soil on piles of laundry or towels on the floor, so it would be best to limit my access to these things in my new home. <p/><p/>My personality color is RED. I am an affectionate cat with a fun-loving personality!  I enjoy getting attention, but I can get overstimulated, so please look for signs that I am done being petted.  I love having a cat tree to sit on and watch the day go by.<p/>",REDK19-116372,A582522,Regional Animal Services of King County,ADOPTABLE,https://petharbor.com/pet.asp?uaid=KING.A582522,"King County Pet Adoption Center 21615 64TH AVE S KENT, WA 98032",Big Bertha,Cat,3 YEARS 1 MONTH,Spayed Female,Domestic Longhair,Black,4/8/19 0:00,Received on,,,,,,,,https://petharbor.com/get_image.asp?RES=Detail&LOCATION=KING&ID=A582522,Image Copyright HLP Inc. 2019,"Received on: 2019-04-08<p/> Description: Black<p/>  Spayed Female Domestic Longhair Cat<p/> Age: 3 YEARS 1 MONTH<p/> Adoption Fee: $30.00<p/> Current Location: King County Pet Adoption Center 21615 64TH AVE S KENT, WA 98032<p/>Hi! My name is Bertha and I am available for adoption.<p/><p/>I was brought in by a good samaritan on April 8, 2019. <p/><p/>I am an incredibly sweet cat who loves attention! I'm playful and active and I love to jump around!  I also love being groomed and getting brushed. I'm just an overall sweet cat!  I came into the shelter with a bad wound on my back end so I'm still healing. You will notice my bad haircut.  Luckily with time that hair will grow back and I will return to my beautiful self!<p/><p/>My personality color is GREEN. I am an adaptable cat who loves to go with the flow! I am outgoing and carefree, and I just can't wait to find my forever home!<p/><p/><p/>",GREENK19-116372,A582522,Regional Animal Services of King County,FOUND,https://petharbor.com/pet.asp?uaid=KING.A582522,"King County Pet Adoption Center 21615 64TH AVE S KENT, WA 98032",Big Bertha,Cat,3 YEARS 1 MONTH,Spayed Female,Domestic Longhair,Black,4/8/19 0:00,Received on,24400 SE 470TH ST,ENUMCLAW,WA,98022,KING COUNTY,,,https://petharbor.com/get_image.asp?RES=Detail&LOCATION=KING&ID=A582522,Image Copyright HLP Inc. 2019,"Received on: 2019-04-08<p/> Found Near: 24400 SE 470TH ST, ENUMCLAW WA 98022<p/> Description: Black Spayed Female Domestic Longhair Cat<p/> Age: 3 YEARS 1 MONTH<p/> Current Location: King County Pet Adoption Center 21615 64TH AVE S KENT, WA 98032<p/>",GREENK19-116396,A567385,Regional Animal Services of King County,ADOPTABLE,https://petharbor.com/pet.asp?uaid=KING.A567385,"King County Pet Adoption Center 21615 64TH AVE S KENT, WA 98032",Angel,Dog,3 YEARS 5 MONTHS,Spayed Female,Labrador Retriever / Pit Bull,Black / White,4/9/19 0:00,Received on,,,,,,,,https://petharbor.com/get_image.asp?RES=Detail&LOCATION=KING&ID=A567385,Image Copyright HLP Inc. 2019,"Received on: 2019-04-09<p/> Description: Black / White<p/>  Spayed Female Labrador Retriever / Pit Bull Dog<p/> Age: 3 YEARS 5 MONTHS<p/> Adoption Fee: $100.00<p/> Current Location: King County Pet Adoption Center 21615 64TH AVE S KENT, WA 98032<p/>Hi! My name is Angel and I am available for adoption.<p/><p/>I was brought in by my previous owner on April 9, 2019 because they had too many dogs. I lived in a home with other dogs, and older children. I'm very sweet but I am a bit of a scaredy cat!  I am looking for a home where I can live in a nice and calm environment. I love to snuggle and give face kisses but please respect my space until we've established a relationship!  <p/><p/>I do like other dogs, but I'd like to get to know them first. I can be very afraid of them, so I would like to meet them and make sure we're a good match. I will likely get along with a calm dog who gives me lots of space. <p/><p/>My personality color is BLUE. I am a gentle and loving dog who likes to take things slow. I may get nervous in new situations, so I am looking for a family who understands that I might take some time to warm up. Once I get to know you, I will be a very devoted friend!<p/><p/><p/>",BLUEK19-116550,A583178,Regional Animal Services of King County,ADOPTABLE,https://petharbor.com/pet.asp?uaid=KING.A583178,"King County Pet Adoption Center 21615 64TH AVE S KENT, WA 98032",Popeye,Cat,11 YEARS 1 MONTH,Neutered Male,Domestic Shorthair,Org Tabby / White,4/17/19 0:00,Received on,,,,,,,,https://petharbor.com/get_image.asp?RES=Detail&LOCATION=KING&ID=A583178,Image Copyright HLP Inc. 2019,"Received on: 2019-04-17<p/> Description: Org Tabby / White<p/>  Neutered Male Domestic Shorthair Cat<p/> Age: 11 YEARS 1 MONTH<p/> Adoption Fee: $30.00<p/> Current Location: King County Pet Adoption Center 21615 64TH AVE S KENT, WA 98032<p/>Hi! My name is Popeye and I am available for adoption.<p/><p/>I was brought in by my previous owner on 4/17/19 because they were moving. I lived in a home with other cats and have been around men, women and children of all ages. My previous owner described me as shy, gentle, sweet and mellow. I love to be petted, held and sit in your lap.<p/><p/>My personality color is BLUE. I am a gentle and loving cat who likes to take things slow. I may get nervous in new situations, so I am looking for a family who understands that I might need some time to warm up. Once I get to know you, I will be a very devoted friend!<p/><p/>I am an affectionate lovebug who would be thrilled to cuddle up with you at home!<p/><p/>My caregivers have noticed that I seem to do well with other cats. When meeting cats in a new home, I would do best with a slow introduction.<p/><p/>Because of my shy nature, I would do best in a calm, quiet home.<p/>",K19-116559,A583233,Regional Animal Services of King County,ADOPTABLE,https://petharbor.com/pet.asp?uaid=KING.A583233,"Kirkland Petco 12040 NE 85TH ST KIRKLAND, WA 98033",Tiger,Cat,2 YEARS,Neutered Male,Domestic Shorthair,Brn Tabby,4/18/19 0:00,Received on,12040 NE 85TH ST,KIRKLAND,WA,98033,KIRKLAND,47.680519,-122.179195,https://petharbor.com/get_image.asp?RES=Detail&LOCATION=KING&ID=A583233,Image Copyright HLP Inc. 2019,"Received on: 2019-04-18<p/> Description: Brn Tabby<p/>  Neutered Male Domestic Shorthair Cat<p/> Age: 2 YEARS<p/> Adoption Fee: $30.00<p/> Current Location: Kirkland Petco 12040 NE 85TH ST KIRKLAND, WA 98033<p/>Hi! My name is Tiger and I am available for adoption. I was brought in by an Animal Control Officer on April 18, 2019.<p/><p/>I'm super sweet but very nervous in this environment. If you go slow and give me head and neck pets I will start to warm up to you. I don't really enjoy being held, I'm a little bit independent and it makes me uncomfortable. I haven't ever lived with a cat, but I think I would probably like them and would give it a try. <p/><p/>My personality color is BLUE. I am a gentle and loving cat who likes to take things slow. I may get nervous in new situations, so I am looking for a family who understands that I might need some time to warm up. Once I get to know you, I will be a very devoted friend!<p/><p/>",BLUEK19-116568,A583284,Regional Animal Services of King County,FOUND,https://kingcounty.gov/depts/regional-animal-services/about-us/overview.aspx,,,Dead Cat,NO AGE,Unaltered,Domestic Mediumhair,Calico,4/19/19 0:00,Received on,18600 SE 128TH ST,RENTON,WA,98059,KING COUNTY,,,,Image Copyright HLP Inc. 2019,"Received on: 2019-04-19<p/> Found Near: 18600 SE 128TH ST, RENTON WA 98059<p/> Description: Calico Unaltered Domestic Mediumhair Cat<p/> Age: NO AGE<p/>",K19-116587,A583342,Regional Animal Services of King County,ADOPTABLE,https://petharbor.com/pet.asp?uaid=KING.A583342,"King County Pet Adoption Center 21615 64TH AVE S KENT, WA 98032",Mallory,Cat,10 YEARS,Spayed Female,Domestic Longhair,Tortie,4/20/19 0:00,Received on,,,,,,,,https://petharbor.com/get_image.asp?RES=Detail&LOCATION=KING&ID=A583342,Image Copyright HLP Inc. 2019,"Received on: 2019-04-20<p/> Description: Tortie<p/>  Spayed Female Domestic Longhair Cat<p/> Age: 10 YEARS<p/> Adoption Fee: $30.00<p/> Current Location: King County Pet Adoption Center 21615 64TH AVE S KENT, WA 98032<p/>Hi! My name is Mallory and I am available for adoption.<p/><p/>I was brought in by a good samaritan on April 20, 2019. <p/><p/>I'm a super sweet and affectionate older lady!  I'm absolutely beautiful and have very unique color patterns. I love being brushed and will need to be groomed regularly to keep my locks beautiful!<p/><p/>My personality color is GREEN. I am an adaptable cat who loves to go with the flow! I am outgoing and carefree, and I just can't wait to find my forever home!<p/><p/><p/>",GREENK19-116587,A583342,Regional Animal Services of King County,FOUND,https://petharbor.com/pet.asp?uaid=KING.A583342,"King County Pet Adoption Center 21615 64TH AVE S KENT, WA 98032",Mallory,Cat,10 YEARS,Spayed Female,Domestic Longhair,Tortie,4/20/19 0:00,Received on,23600 PACIFIC HWY S,KENT,WA,98032,KENT,,,https://petharbor.com/get_image.asp?RES=Detail&LOCATION=KING&ID=A583342,Image Copyright HLP Inc. 2019,"Received on: 2019-04-20<p/> Found Near: 23600 PACIFIC HWY S, KENT WA 98032<p/> Description: Tortie Spayed Female Domestic Longhair Cat<p/> Age: 10 YEARS<p/> Current Location: King County Pet Adoption Center 21615 64TH AVE S KENT, WA 98032<p/>",GREENK19-116656,A583527,Regional Animal Services of King County,ADOPTABLE,https://petharbor.com/pet.asp?uaid=KING.A583527,"King County Pet Adoption Center 21615 64TH AVE S KENT, WA 98032",Beverley,Cat,1 YEAR,Spayed Female,Domestic Shorthair,Black,4/23/19 0:00,Received on,,,,,,,,https://petharbor.com/get_image.asp?RES=Detail&LOCATION=KING&ID=A583527,Image Copyright HLP Inc. 2019,"Received on: 2019-04-23<p/> Description: Black<p/>  Spayed Female Domestic Shorthair Cat<p/> Age: 1 YEAR<p/> Adoption Fee: $30.00<p/> Current Location: King County Pet Adoption Center 21615 64TH AVE S KENT, WA 98032<p/>Hi! My name is Beverley and I am available for adoption.<p/><p/><p/>I was brought in by a good samaritan on 4/23/19.<p/><p/><p/>My personality color is BLUE. I am a gentle and loving cat who likes to take things slow. I may get nervous in new situations, so I am looking for a family who understands that I might need some time to warm up. Once I get to know you, I will be a very devoted friend!<p/><p/><p/>I am an affectionate lovebug who would be thrilled to cuddle up with you at home!<p/><p/><p/>I might do well with other cats. When meeting cats in a new home, I would do best with a slow introduction.<p/><p/><p/>Because of my shy nature, I would do best in a calm, quiet home.<p/>",BLUEK19-116654,A583525,Regional Animal Services of King County,FOUND,https://kingcounty.gov/depts/regional-animal-services/about-us/overview.aspx,,,Dead Cat,NO AGE,Unaltered,Domestic Mediumhair,Brn Tabby,4/23/19 0:00,Received on,11600 SE 258TH ST,KENT,WA,98030,KENT,,,,Image Copyright HLP Inc. 2019,"Received on: 2019-04-23<p/> Found Near: 11600 SE 258TH ST, KENT WA 98030<p/> Description: Brn Tabby Unaltered Domestic Mediumhair Cat<p/> Age: NO AGE<p/>",K19-116648,A574834,Regional Animal Services of King County,FOUND,https://kingcounty.gov/depts/regional-animal-services/about-us/overview.aspx,,7,Dead Cat,1 YEAR 5 MONTHS,Neutered Male,Domestic Shorthair,Black,4/23/19 0:00,Received on,19800 140TH AVE SE,RENTON,WA,98058,KING COUNTY,,,,Image Copyright HLP Inc. 2019,"Received on: 2019-04-23<p/> Found Near: 19800 140TH AVE SE, RENTON WA 98058<p/> Description: Black Neutered Male Domestic Shorthair Cat<p/> Age: 1 YEAR 5 MONTHS<p/>",K19-116651,A583521,Regional Animal Services of King County,FOUND,https://kingcounty.gov/depts/regional-animal-services/about-us/overview.aspx,,,Dead Cat,NO AGE,Unaltered,Domestic Shorthair,Gray,4/23/19 0:00,Received on,23700 100TH AVE SE,KENT,WA,98031,KENT,,,,Image Copyright HLP Inc. 2019,"Received on: 2019-04-23<p/> Found Near: 23700 100TH AVE SE, KENT WA 98031<p/> Description: Gray Unaltered Domestic Shorthair Cat<p/> Age: NO AGE<p/>",K19-116656,A583527,Regional Animal Services of King County,FOUND,https://petharbor.com/pet.asp?uaid=KING.A583527,"King County Pet Adoption Center 21615 64TH AVE S KENT, WA 98032",Beverley,Cat,1 YEAR,Spayed Female,Domestic Shorthair,Black,4/23/19 0:00,Received on,3200 S 169TH ST,SEATAC,WA,98188,SEATAC,,,https://petharbor.com/get_image.asp?RES=Detail&LOCATION=KING&ID=A583527,Image Copyright HLP Inc. 2019,"Received on: 2019-04-23<p/> Found Near: 3200 S 169TH ST, SEATAC WA 98188<p/> Description: Black Spayed Female Domestic Shorthair Cat<p/> Age: 1 YEAR<p/> Current Location: King County Pet Adoption Center 21615 64TH AVE S KENT, WA 98032<p/>",BLUEK19-116632,A583503,Regional Animal Services of King County,FOUND,https://kingcounty.gov/depts/regional-animal-services/about-us/overview.aspx,,,Dead Cat,2 YEARS,Male,Domestic Shorthair,Org Tabby,4/23/19 0:00,Received on,6800 148TH AVE NE,REDMOND,WA,98052,REDMOND,47.661856,-122.143092,,Image Copyright HLP Inc. 2019,"Received on: 2019-04-23<p/> Found Near: 6800 148TH AVE NE, REDMOND WA 98052<p/> Description: Org Tabby Male Domestic Shorthair Cat<p/> Age: 2 YEARS<p/>",K19-116673,A583586,Regional Animal Services of King County,ADOPTABLE,https://petharbor.com/pet.asp?uaid=KING.A583586,"King County Pet Adoption Center 21615 64TH AVE S KENT, WA 98032",Sergio,Dog,3 YEARS,Neutered Male,Pit Bull / Siberian Husky,Tan / White,4/24/19 0:00,Received on,,,,,,,,https://petharbor.com/get_image.asp?RES=Detail&LOCATION=KING&ID=A583586,Image Copyright HLP Inc. 2019,"Received on: 2019-04-24<p/> Description: Tan / White<p/>  Neutered Male Pit Bull / Siberian Husky Dog<p/> Age: 3 YEARS<p/> Adoption Fee: $225.00<p/> Current Location: King County Pet Adoption Center 21615 64TH AVE S KENT, WA 98032<p/>Hi! My name is Sergio and I am available for adoption.<p/><p/>I was brought in by an Animal Control Officer on 4/24/19.<p/><p/>My personality color is GREEN. I am an adaptable dog who loves to go with the flow! I am outgoing and carefree, and I just can't wait to find my forever home!<p/><p/>I am an affectionate lovebug who would be thrilled to cuddle up with you at home!<p/><p/>I am full of energy and I love to play! I tend to calm down more when the people around me stay calm. I do best when I have lots of exercise and something to keep my mind busy.<p/><p/><p/>",GREENK19-116673,A583586,Regional Animal Services of King County,FOUND,https://petharbor.com/pet.asp?uaid=KING.A583586,"King County Pet Adoption Center 21615 64TH AVE S KENT, WA 98032",Sergio,Dog,3 YEARS,Neutered Male,Pit Bull / Siberian Husky,Tan / White,4/24/19 0:00,Received on,27000 174TH PL SE,COVINGTON,WA,98042,COVINGTON,,,https://petharbor.com/get_image.asp?RES=Detail&LOCATION=KING&ID=A583586,Image Copyright HLP Inc. 2019,"Received on: 2019-04-24<p/> Found Near: 27000 174TH PL SE, COVINGTON WA 98042<p/> Description: Tan / White Neutered Male Pit Bull / Siberian Husky Dog<p/> Age: 3 YEARS<p/> Current Location: King County Pet Adoption Center 21615 64TH AVE S KENT, WA 98032<p/>",GREENK19-116720,A583708,Regional Animal Services of King County,ADOPTABLE,https://petharbor.com/pet.asp?uaid=KING.A583708,"King County Pet Adoption Center 21615 64TH AVE S KENT, WA 98032",Edgar,Rat,1 YEAR 6 MONTHS,Male,Rat,Gray / White,4/25/19 0:00,Received on,,,,,,,,https://petharbor.com/get_image.asp?RES=Detail&LOCATION=KING&ID=A583708,Image Copyright HLP Inc. 2019,"Received on: 2019-04-25<p/> Description: Gray / White<p/>  Male Rat Rat<p/> Age: 1 YEAR 6 MONTHS<p/> Adoption Fee: An Adoption Fee has not been set. Please inquire with the shelter.<p/> Current Location: King County Pet Adoption Center 21615 64TH AVE S KENT, WA 98032<p/><p/>",K19-116719,A583707,Regional Animal Services of King County,ADOPTABLE,https://petharbor.com/pet.asp?uaid=KING.A583707,"King County Pet Adoption Center 21615 64TH AVE S KENT, WA 98032",Walter,Rat,1 YEAR 6 MONTHS,Male,Rat,Gray / White,4/25/19 0:00,Received on,,,,,,,,https://petharbor.com/get_image.asp?RES=Detail&LOCATION=KING&ID=A583707,Image Copyright HLP Inc. 2019,"Received on: 2019-04-25<p/> Description: Gray / White<p/>  Male Rat Rat<p/> Age: 1 YEAR 6 MONTHS<p/> Adoption Fee: An Adoption Fee has not been set. Please inquire with the shelter.<p/> Current Location: King County Pet Adoption Center 21615 64TH AVE S KENT, WA 98032<p/><p/>",K19-116730,A583727,Regional Animal Services of King County,ADOPTABLE,https://kingcounty.gov/depts/regional-animal-services/about-us/overview.aspx,In RASKC Foster Home,Cheddar,Cat,2 YEARS,Neutered Male,Domestic Longhair,Org Tabby / White,4/26/19 0:00,Received on,21615 64TH AVE S,KENT,WA,98032,KING COUNTY,47.407788,-122.255197,https://petharbor.com/get_image.asp?RES=Detail&LOCATION=KING&ID=A583727,Image Copyright HLP Inc. 2019,"Received on: 2019-04-26<p/> Description: Org Tabby / White Neutered Male Domestic Longhair Cat<p/> Age: 2 YEARS<p/> Adoption Fee: $30.00<p/> Current Location: In RASKC Foster Home <p/>Hi! My name is Cheddar and I am available for adoption.<p/><p/>I was brought in by a good samaritan on April 25, 2019. <p/><p/>I'm a fun, loving guy with a delightful personality.  I'm super sweet and affectionate but I also like to run around and play! I'm looking for a loving family with lots of attention to give me!<p/><p/>My personality color is GREEN. I am an adaptable cat who loves to go with the flow! I am outgoing and carefree, and I just can't wait to find my forever home!<p/><p/><p/>",K19-116791,A583814,Regional Animal Services of King County,FOUND,https://kingcounty.gov/depts/regional-animal-services/about-us/overview.aspx,,,Dead Bird,NO AGE,Unaltered,Duck,Yellow / Brown,4/28/19 0:00,Received on,16300 ASH WAY,LYNNWOOD,WA,98087,SNOHOMISH COUNT,,,,Image Copyright HLP Inc. 2019,"Received on: 2019-04-28<p/> Found Near: 16300 ASH WAY, LYNNWOOD WA 98087<p/> Description: Yellow / Brown Unaltered Duck Bird<p/> Age: NO AGE<p/>",K19-116788,A583812,Regional Animal Services of King County,FOUND,https://kingcounty.gov/depts/regional-animal-services/about-us/overview.aspx,,,Dead Dog,NO AGE,Male,Pit Bull,Tan / White,4/28/19 0:00,Received on,21000 FRAGER RD S,KENT,WA,98032,KENT,47.41338,-122.265179,,Image Copyright HLP Inc. 2019,"Received on: 2019-04-28<p/> Found Near: 21000 FRAGER RD S, KENT WA 98032<p/> Description: Tan / White Male Pit Bull Dog<p/> Age: NO AGE<p/>",K19-116810,A583881,Regional Animal Services of King County,ADOPTABLE,https://petharbor.com/pet.asp?uaid=KING.A583881,"King County Pet Adoption Center 21615 64TH AVE S KENT, WA 98032",Edgar,Cat,2 YEARS,Neutered Male,Domestic Shorthair,Brn Tabby,4/29/19 0:00,Received on,,,,,,,,https://petharbor.com/get_image.asp?RES=Detail&LOCATION=KING&ID=A583881,Image Copyright HLP Inc. 2019,"Received on: 2019-04-29<p/> Description: Brn Tabby<p/>  Neutered Male Domestic Shorthair Cat<p/> Age: 2 YEARS<p/> Adoption Fee: $30.00<p/> Current Location: King County Pet Adoption Center 21615 64TH AVE S KENT, WA 98032<p/>Hi! My name is Edgar and I am available for adoption.<p/><p/>I was brought in by a good samaritan on April 29th, 2019.<p/><p/>I am a shy guy who tries really hard to be social but my nerves get the best of me sometimes and I hide. I really do love pets but because I am such a nervous nelly, I can get overstimulated with petting, so please move carefully with me and keep an eye out for signs that I might need a break .My caregivers have noticed that I seem to do well with other cats. When meeting cats in a new home, I would do best with a slow introduction.<p/><p/>My personality color is BLUE. I am a gentle and loving cat who likes to take things slow. I may get nervous in new situations, so I am looking for a family who understands that I might need some time to warm up. Once I get to know you, I will be a very devoted friend!<p/><p/>",BLUEK19-116804,A583858,Regional Animal Services of King County,ADOPTABLE,https://petharbor.com/pet.asp?uaid=KING.A583858,"King County Pet Adoption Center 21615 64TH AVE S KENT, WA 98032",Garfield,Cat,1 YEAR 6 MONTHS,Neutered Male,Domestic Shorthair,Org Tabby / White,4/29/19 0:00,Received on,,,,,,,,https://petharbor.com/get_image.asp?RES=Detail&LOCATION=KING&ID=A583858,Image Copyright HLP Inc. 2019,"Received on: 2019-04-29<p/> Description: Org Tabby / White<p/>  Neutered Male Domestic Shorthair Cat<p/> Age: 1 YEAR 6 MONTHS<p/> Adoption Fee: $30.00<p/> Current Location: King County Pet Adoption Center 21615 64TH AVE S KENT, WA 98032<p/>Hi! My name is Garfield and I am available for adoption.<p/><p/>I was brought in by my previous owner on 4/29/19. I've lived mainly outdoors with my brothers and sisters. My previous owner described me as shy and loving.<p/><p/>Hi there, I'm what you would call an undersocialized kitten. It doesn't mean anything bad it just means when I was wee little one, I was not taught about how nice and awesome people can be to me. I'm very scared at first but once you take the time to show me I can trust you, I will melt in your arms. Although, I'm a fearful kitty, I actually really love to snuggle and purr! I would love to go to a home with one of my siblings or with a younger, confident kitty friend! <p/><p/>My personality color is BLUE. I am a gentle and loving cat who likes to take things slow. I may get nervous in new situations, so I am looking for a family who understands that I might need some time to warm up. Once I get to know you, I will be a very devoted friend!<p/><p/>",BLUEK19-116810,A583881,Regional Animal Services of King County,FOUND,https://petharbor.com/pet.asp?uaid=KING.A583881,"King County Pet Adoption Center 21615 64TH AVE S KENT, WA 98032",Edgar,Cat,2 YEARS,Neutered Male,Domestic Shorthair,Brn Tabby,4/29/19 0:00,Received on,19900 SE 283RD ST,AUBURN,WA,98092,AUBURN,,,https://petharbor.com/get_image.asp?RES=Detail&LOCATION=KING&ID=A583881,Image Copyright HLP Inc. 2019,"Received on: 2019-04-29<p/> Found Near: 19900 SE 283RD ST, AUBURN WA 98092<p/> Description: Brn Tabby Neutered Male Domestic Shorthair Cat<p/> Age: 2 YEARS<p/> Current Location: King County Pet Adoption Center 21615 64TH AVE S KENT, WA 98032<p/>",BLUEK19-116846,A584038,Regional Animal Services of King County,ADOPTABLE,https://petharbor.com/pet.asp?uaid=KING.A584038,"King County Pet Adoption Center 21615 64TH AVE S KENT, WA 98032",Missy,Dog,7 YEARS,Spayed Female,Chihuahua - Smooth Coated,Black / Brown,5/1/19 0:00,Received on,,,,,,,,https://petharbor.com/get_image.asp?RES=Detail&LOCATION=KING&ID=A584038,Image Copyright HLP Inc. 2019,"Received on: 2019-05-01<p/> Description: Black / Brown<p/>  Spayed Female Chihuahua - Smooth Coated Dog<p/> Age: 7 YEARS<p/> Adoption Fee: $200.00<p/> Current Location: King County Pet Adoption Center 21615 64TH AVE S KENT, WA 98032<p/>Hi! My name is Missy and I am available for adoption.<p/><p/>I was brought in by my previous owner on 5/1/19 because they are unable to care for me.<p/><p/>My personality color is BLUE. I am a gentle and loving dog who likes to take things slow. I may get nervous in new situations, so I am looking for a family who understands that I might take some time to warm up. Once I get to know you, I will be a very devoted friend!<p/><p/><p/>I am an affectionate lovebug who would be thrilled to cuddle up with you at home!<p/><p/>My caregivers have noticed that I seem to do well with other small dogs. When meeting dogs in a new home, I would do best with a slow introduction.<p/><p/>Because of my shy nature, I would do best in a calm, quiet home.<p/><p/><p/>",BLUEK19-116854,A584050,Regional Animal Services of King County,ADOPTABLE,https://petharbor.com/pet.asp?uaid=KING.A584050,"King County Pet Adoption Center 21615 64TH AVE S KENT, WA 98032",Celeste,Cat,2 YEARS,Spayed Female,Domestic Longhair,Black,5/1/19 0:00,Received on,,,,,,,,https://petharbor.com/get_image.asp?RES=Detail&LOCATION=KING&ID=A584050,Image Copyright HLP Inc. 2019,"Received on: 2019-05-01<p/> Description: Black<p/>  Spayed Female Domestic Longhair Cat<p/> Age: 2 YEARS<p/> Adoption Fee: $30.00<p/> Current Location: King County Pet Adoption Center 21615 64TH AVE S KENT, WA 98032<p/>Hi! My name is Celeste and I am available for adoption.<p/><p/>I was brought in by a good samaritan on May 1, 2019.<p/><p/>I am a sweet but shy gal who just wants to relax and find a home to call my own. I really like quiet, serene and peaceful humans who love to give really nice chin scratches. Take me home and have a bestie for life! <p/><p/>My personality color is BLUE. I am a gentle and loving cat who likes to take things slow. I may get nervous in new situations, so I am looking for a family who understands that I might need some time to warm up. Once I get to know you, I will be a very devoted friend!<p/><p/><p/>",BLUEK19-116853,A226824,Regional Animal Services of King County,ADOPTABLE,https://petharbor.com/pet.asp?uaid=KING.A226824,"King County Pet Adoption Center 21615 64TH AVE S KENT, WA 98032",Cookie,Dog,13 YEARS,Spayed Female,Shih Tzu / Mix,Gray / White,5/1/19 0:00,Received on,,,,,,,,https://petharbor.com/get_image.asp?RES=Detail&LOCATION=KING&ID=A226824,Image Copyright HLP Inc. 2019,"Received on: 2019-05-01<p/> Description: Gray / White<p/>  Spayed Female Shih Tzu / Mix Dog<p/> Age: 13 YEARS<p/> Adoption Fee: $100.00<p/> Current Location: King County Pet Adoption Center 21615 64TH AVE S KENT, WA 98032<p/>Hi! My name is Cookie and I am available for adoption.<p/><p/>I was brought in by my previous owner on 5/1/19 because unable to care for me.<p/><p/>My personality color is GREEN. I am an adaptable dog who loves to go with the flow! I am outgoing and carefree, and I just can't wait to find my forever home!<p/><p/>I am an affectionate lovebug who would be thrilled to cuddle up with you at home!<p/><p/>My caregivers have noticed that I seem to do well with other small dogs. When meeting dogs in a new home, I would do best with a slow introduction.<p/><p/><p/>",GREENK19-116854,A584050,Regional Animal Services of King County,FOUND,https://petharbor.com/pet.asp?uaid=KING.A584050,"King County Pet Adoption Center 21615 64TH AVE S KENT, WA 98032",Celeste,Cat,2 YEARS,Spayed Female,Domestic Longhair,Black,5/1/19 0:00,Received on,23800 110TH AVE SE,KENT,WA,98031,KENT,,,https://petharbor.com/get_image.asp?RES=Detail&LOCATION=KING&ID=A584050,Image Copyright HLP Inc. 2019,"Received on: 2019-05-01<p/> Found Near: 23800 110TH AVE SE, KENT WA 98031<p/> Description: Black Spayed Female Domestic Longhair Cat<p/> Age: 2 YEARS<p/> Current Location: King County Pet Adoption Center 21615 64TH AVE S KENT, WA 98032<p/>",BLUEK19-116859,A584055,Regional Animal Services of King County,FOUND,https://kingcounty.gov/depts/regional-animal-services/about-us/overview.aspx,,,Dead Cat,4 YEARS,Unaltered,Domestic Shorthair,Black,5/1/19 0:00,Received on,24000 36TH AVE S,KENT,WA,98032,KENT,,,,Image Copyright HLP Inc. 2019,"Received on: 2019-05-01<p/> Found Near: 24000 36TH AVE S, KENT WA 98032<p/> Description: Black Unaltered Domestic Shorthair Cat<p/> Age: 4 YEARS<p/>",K19-116887,A584139,Regional Animal Services of King County,ADOPTABLE,https://petharbor.com/pet.asp?uaid=KING.A584139,"King County Pet Adoption Center 21615 64TH AVE S KENT, WA 98032",Sydney,Dog,2 YEARS,Spayed Female,American Staffordshire / Mix,Brown / White,5/2/19 0:00,Received on,,,,,,,,https://petharbor.com/get_image.asp?RES=Detail&LOCATION=KING&ID=A584139,Image Copyright HLP Inc. 2019,"Received on: 2019-05-02<p/> Description: Brown / White<p/>  Spayed Female American Staffordshire / Mix Dog<p/> Age: 2 YEARS<p/> Adoption Fee: $100.00<p/> Current Location: King County Pet Adoption Center 21615 64TH AVE S KENT, WA 98032<p/>Hi, my name is Sydney!<p/><p/>I came to the shelter on 5/2/19.<p/><p/>My personality color is BLUE. I am a gentle and loving dog who likes to take things slow. I may get nervous in new situations, so I am looking for a family who understands that I might take some time to warm up. Once I get to know you, I will be a very devoted friend!<p/><p/>I am an affectionate lovebug who would be thrilled to cuddle up with you at home!<p/><p/>I am full of energy and I love to play! I tend to calm down more when the people around me stay calm. I do best when I have lots of exercise and something to keep my mind busy.<p/><p/>My caregivers have noticed that I seem to do well with other dogs. When meeting dogs in a new home, I would do best with a slow introduction.<p/><p/>I would do best in a home with older children.<p/><p/>Come meet me today!<p/>",BLUEK19-116886,A480900,Regional Animal Services of King County,ADOPTABLE,https://petharbor.com/pet.asp?uaid=KING.A480900,"King County Pet Adoption Center 21615 64TH AVE S KENT, WA 98032",Chester,Cat,13 YEARS 6 MONTHS,Neutered Male,Domestic Shorthair,Org Tabby / White,5/2/19 0:00,Received on,,,,,,,,https://petharbor.com/get_image.asp?RES=Detail&LOCATION=KING&ID=A480900,Image Copyright HLP Inc. 2019,"Received on: 2019-05-02<p/> Description: Org Tabby / White<p/>  Neutered Male Domestic Shorthair Cat<p/> Age: 13 YEARS 6 MONTHS<p/> Adoption Fee: $30.00<p/> Current Location: King County Pet Adoption Center 21615 64TH AVE S KENT, WA 98032<p/>Hi! My name is Chester and I am available for adoption.<p/><p/>I was brought in by my previous owner on 5/2/19 because I did not get along with baby in the house. I lived in a home with cats and young children but I did not get along with them. My previous owner described me as "" every stranger is a friend he just hasn't met yet"". And "" he is like a dog and licks and nibbles on everything""<p/><p/>My personality color is RED. I am a spirited cat with a fun-loving personality! I may be sensitive to handling, so I would do best in a home with a cat savvy family who knows when to give me some space.<p/><p/>I am an affectionate lovebug but I can also be an independent kitty who likes to do my own thing! If we can find the right balance between the two we will get along just fine.<p/><p/>I like getting attention on my own terms. I can get overstimulated with petting, so please move carefully with me and keep an eye out for signs that I might need a break.<p/><p/>My caregivers have noticed that I do not seem to get along with other cats, so I may do best as the only cat in my new home.<p/><p/>Because of my nature, I would do best in an adult.<p/>",K19-116887,A584139,Regional Animal Services of King County,FOUND,https://petharbor.com/pet.asp?uaid=KING.A584139,"King County Pet Adoption Center 21615 64TH AVE S KENT, WA 98032",Sydney,Dog,2 YEARS,Spayed Female,American Staffordshire / Mix,Brown / White,5/2/19 0:00,Received on,28600 137TH AVE SE,KENT,WA,98042,KENT,,,https://petharbor.com/get_image.asp?RES=Detail&LOCATION=KING&ID=A584139,Image Copyright HLP Inc. 2019,"Received on: 2019-05-02<p/> Found Near: 28600 137TH AVE SE, KENT WA 98042<p/> Description: Brown / White Spayed Female American Staffordshire / Mix Dog<p/> Age: 2 YEARS<p/> Current Location: King County Pet Adoption Center 21615 64TH AVE S KENT, WA 98032<p/>",BLUEK19-116903,A584184,Regional Animal Services of King County,ADOPTABLE,https://petharbor.com/pet.asp?uaid=KING.A584184,"King County Pet Adoption Center 21615 64TH AVE S KENT, WA 98032",Buckaroo,Cat,11 YEARS,Neutered Male,Domestic Shorthair,Brn Tabby / White,5/3/19 0:00,Received on,,,,,,,,https://petharbor.com/get_image.asp?RES=Detail&LOCATION=KING&ID=A584184,Image Copyright HLP Inc. 2019,"Received on: 2019-05-03<p/> Description: Brn Tabby / White<p/>  Neutered Male Domestic Shorthair Cat<p/> Age: 11 YEARS<p/> Adoption Fee: $30.00<p/> Current Location: King County Pet Adoption Center 21615 64TH AVE S KENT, WA 98032<p/>Hi! My name is Buckaroo and I am available for adoption.<p/><p/>I was brought in by my previous owner on 5/3/19 because they were moving. I lived in a home with another cat. <p/><p/>I am an affectionate lovebug who would be thrilled to cuddle up with you at home!<p/><p/>My caregivers have noticed that I seem to do well with other cats. When meeting cats in a new home, I would do best with a slow introduction.<p/><p/>My personality color is BLUE. I am a gentle and loving cat who likes to take things slow. I may get nervous in new situations, so I am looking for a family who understands that I might need some time to warm up. Once I get to know you, I will be a very devoted friend!<p/><p/>",BLUEK19-116900,A536164,Regional Animal Services of King County,ADOPTABLE,https://petharbor.com/pet.asp?uaid=KING.A536164,"King County Pet Adoption Center 21615 64TH AVE S KENT, WA 98032",Ella,Dog,4 YEARS,Spayed Female,Labrador Retriever / Australian Shepherd,Chocolate / White,5/3/19 0:00,Received on,,,,,,,,https://petharbor.com/get_image.asp?RES=Detail&LOCATION=KING&ID=A536164,Image Copyright HLP Inc. 2019,"Received on: 2019-05-03<p/> Description: Chocolate / White<p/>  Spayed Female Labrador Retriever / Australian Shepherd Dog<p/> Age: 4 YEARS<p/> Adoption Fee: $200.00<p/> Current Location: King County Pet Adoption Center 21615 64TH AVE S KENT, WA 98032<p/>Hi! My name is Ella and I am available for adoption.<p/><p/>I was brought in by my previous owner on May 3, 2019 because they were moving to an apartment and knew I would not thrive there. I lived in a home with small children. My previous owner described me as outgoing and energetic.<p/><p/>I am a very smart dog! I have shown my caregivers that I already know how to ""sit"".<p/><p/>I am an affectionate lovebug who would be thrilled to cuddle up with you at home!<p/><p/>I am full of energy and I love to play! I tend to calm down more when the people around me stay calm. I do best when I have lots of exercise and something to keep my mind busy.I do have a tendancy to be jumpy so I would do best in a home with children who are okay with that and family members who can help train me to learn my manners!<p/><p/> My caregivers have noticed that I seem to do well with other dogs. When meeting dogs in a new home, I would do best with a slow introduction.<p/><p/><p/>My personality color is RED. I am a spirited dog with a fun-loving personality! I am still working on my manners, so I would do best with a family who is willing to work with me and help me become the best dog I can be!<p/>",REDK19-116924,A584221,Regional Animal Services of King County,ADOPTABLE,https://petharbor.com/pet.asp?uaid=KING.A584221,"King County Pet Adoption Center 21615 64TH AVE S KENT, WA 98032",Ivan,Cat,2 YEARS,Neutered Male,Domestic Shorthair,Black / White,5/4/19 0:00,Received on,,,,,,,,https://petharbor.com/get_image.asp?RES=Detail&LOCATION=KING&ID=A584221,Image Copyright HLP Inc. 2019,"Received on: 2019-05-04<p/> Description: Black / White<p/>  Neutered Male Domestic Shorthair Cat<p/> Age: 2 YEARS<p/> Adoption Fee: $30.00<p/> Current Location: King County Pet Adoption Center 21615 64TH AVE S KENT, WA 98032<p/>Hi! My name is Ivan and I am available for adoption.<p/><p/>I was brought in by a good samaritan on May 4th, 2019.<p/><p/>I'm a very active guy who likes to keep busy! I would love to find a home with an equally active and social family. I love enrichment and I am quite smart, figuring out puzzles with my food is very fun for me! I'm not a big snuggly guy, I like getting attention on my own terms. I can get overstimulated with petting, so please move carefully with me and keep an eye out for signs that I might need a break.<p/><p/>My personality color is RED. I am a spirited cat with a fun-loving personality! I may be sensitive to handling, so I would do best in a home with a cat savvy family who knows when to give me some space.<p/>",REDK19-116917,A562909,Regional Animal Services of King County,ADOPTABLE,https://petharbor.com/pet.asp?uaid=KING.A562909,"King County Pet Adoption Center 21615 64TH AVE S KENT, WA 98032",Trixee,Dog,5 YEARS 10 MONTHS,Spayed Female,Shih Tzu / Miniature Schnauzer,Black / White,5/4/19 0:00,Received on,,,,,,,,https://petharbor.com/get_image.asp?RES=Detail&LOCATION=KING&ID=A562909,Image Copyright HLP Inc. 2019,"Received on: 2019-05-04<p/> Description: Black / White<p/>  Spayed Female Shih Tzu / Miniature Schnauzer Dog<p/> Age: 5 YEARS 10 MONTHS<p/> Adoption Fee: $200.00<p/> Current Location: King County Pet Adoption Center 21615 64TH AVE S KENT, WA 98032<p/>Hi! My name is Trixie and I am available for adoption.<p/><p/>I was brought in by my previous owner on 5/4/19 because they are unable to care for me.<p/><p/>My personality color is GREEN. I am an adaptable dog who loves to go with the flow! I am outgoing and carefree, and I just can't wait to find my forever home!<p/><p/>I am an affectionate lovebug who would be thrilled to cuddle up with you at home!<p/><p/>My caregivers have noticed that I seem to do well with other small dogs. When meeting dogs in a new home, I would do best with a slow introduction.<p/><p/><p/>",GREENK19-116924,A584221,Regional Animal Services of King County,FOUND,https://petharbor.com/pet.asp?uaid=KING.A584221,"King County Pet Adoption Center 21615 64TH AVE S KENT, WA 98032",Ivan,Cat,2 YEARS,Neutered Male,Domestic Shorthair,Black / White,5/4/19 0:00,Received on,18000 NE 99TH CT,REDMOND,WA,98052,REDMOND,,,https://petharbor.com/get_image.asp?RES=Detail&LOCATION=KING&ID=A584221,Image Copyright HLP Inc. 2019,"Received on: 2019-05-04<p/> Found Near: 18000 NE 99TH CT, REDMOND WA 98052<p/> Description: Black / White Neutered Male Domestic Shorthair Cat<p/> Age: 2 YEARS<p/> Current Location: King County Pet Adoption Center 21615 64TH AVE S KENT, WA 98032<p/>",REDK19-116919,A584217,Regional Animal Services of King County,FOUND,https://kingcounty.gov/depts/regional-animal-services/about-us/overview.aspx,In RASKC Foster Home,,Cat,6 WEEKS,Female,Domestic Shorthair,Gray Tabby,5/4/19 0:00,Received on,39900 SE 53RD ST,SNOQUALMIE,WA,98065,KING COUNTY,,,https://petharbor.com/get_image.asp?RES=Detail&LOCATION=KING&ID=A584217,Image Copyright HLP Inc. 2019,"Received on: 2019-05-04<p/> Found Near: 39900 SE 53RD ST, SNOQUALMIE WA 98065<p/> Description: Gray Tabby Female Domestic Shorthair Cat<p/> Age: 6 WEEKS<p/> Current Location: In RASKC Foster Home <p/>",K19-116921,A584219,Regional Animal Services of King County,FOUND,https://kingcounty.gov/depts/regional-animal-services/about-us/overview.aspx,In RASKC Foster Home,,Cat,6 WEEKS,Female,Domestic Shorthair,Gray Tabby,5/4/19 0:00,Received on,39900 SE 53RD ST,SNOQUALMIE,WA,98065,KING COUNTY,,,https://petharbor.com/get_image.asp?RES=Detail&LOCATION=KING&ID=A584219,Image Copyright HLP Inc. 2019,"Received on: 2019-05-04<p/> Found Near: 39900 SE 53RD ST, SNOQUALMIE WA 98065<p/> Description: Gray Tabby Female Domestic Shorthair Cat<p/> Age: 6 WEEKS<p/> Current Location: In RASKC Foster Home <p/>",K19-116922,A584220,Regional Animal Services of King County,FOUND,https://kingcounty.gov/depts/regional-animal-services/about-us/overview.aspx,In RASKC Foster Home,,Cat,6 WEEKS,Female,Domestic Shorthair,Gray Tabby,5/4/19 0:00,Received on,39900 SE 53RD ST,SNOQUALMIE,WA,98065,KING COUNTY,,,https://petharbor.com/get_image.asp?RES=Detail&LOCATION=KING&ID=A584220,Image Copyright HLP Inc. 2019,"Received on: 2019-05-04<p/> Found Near: 39900 SE 53RD ST, SNOQUALMIE WA 98065<p/> Description: Gray Tabby Female Domestic Shorthair Cat<p/> Age: 6 WEEKS<p/> Current Location: In RASKC Foster Home <p/>",K19-116920,A584218,Regional Animal Services of King County,FOUND,https://kingcounty.gov/depts/regional-animal-services/about-us/overview.aspx,In RASKC Foster Home,,Cat,6 WEEKS,Female,Domestic Shorthair,Gray Tabby,5/4/19 0:00,Received on,39900 SE 53RD ST,SNOQUALMIE,WA,98065,KING COUNTY,,,https://petharbor.com/get_image.asp?RES=Detail&LOCATION=KING&ID=A584218,Image Copyright HLP Inc. 2019,"Received on: 2019-05-04<p/> Found Near: 39900 SE 53RD ST, SNOQUALMIE WA 98065<p/> Description: Gray Tabby Female Domestic Shorthair Cat<p/> Age: 6 WEEKS<p/> Current Location: In RASKC Foster Home <p/>",K19-116926,A584222,Regional Animal Services of King County,FOUND,https://kingcounty.gov/depts/regional-animal-services/about-us/overview.aspx,,,Dead Cat,4 YEARS,Unaltered,Domestic Shorthair,Brn Tabby,5/4/19 0:00,Received on,6400 S 236TH PL,KENT,WA,98032,KENT,,,,Image Copyright HLP Inc. 2019,"Received on: 2019-05-04<p/> Found Near: 6400 S 236TH PL, KENT WA 98032<p/> Description: Brn Tabby Unaltered Domestic Shorthair Cat<p/> Age: 4 YEARS<p/>",K19-116932,A584257,Regional Animal Services of King County,FOUND,https://kingcounty.gov/depts/regional-animal-services/about-us/overview.aspx,,,Dead Bird,NO AGE,Unaltered,Crow,Black,5/5/19 0:00,Received on,11700 157TH AVE NE,REDMOND,WA,98052,REDMOND,,,,Image Copyright HLP Inc. 2019,"Received on: 2019-05-05<p/> Found Near: 11700 157TH AVE NE, REDMOND WA 98052<p/> Description: Black Unaltered Crow Bird<p/> Age: NO AGE<p/>",K19-116942,A584265,Regional Animal Services of King County,FOUND,https://petharbor.com/pet.asp?uaid=KING.A584265,"King County Pet Adoption Center 21615 64TH AVE S KENT, WA 98032",Gunner,Dog,NO AGE,Male,Chihuahua - Smooth Coated,Tan,5/5/19 0:00,Received on,400 SOUTH FORK AVE SW,NORTH BEND,WA,98045,NORTH BEND,,,https://petharbor.com/get_image.asp?RES=Detail&LOCATION=KING&ID=A584265,Image Copyright HLP Inc. 2019,"Received on: 2019-05-05<p/> Found Near: 400 SOUTH FORK AVE SW, NORTH BEND WA 98045<p/> Description: Tan Male Chihuahua - Smooth Coated Dog<p/> Age: NO AGE<p/> Current Location: King County Pet Adoption Center 21615 64TH AVE S KENT, WA 98032<p/>",K19-116963,A584316,Regional Animal Services of King County,FOUND,https://kingcounty.gov/depts/regional-animal-services/about-us/overview.aspx,In RASKC Foster Home,Louie,Cat,7 WEEKS,Male,Domestic Shorthair,Brn Tabby / White,5/6/19 0:00,Received on,11000 SE 319TH CT AUBURN,,WA,98092,AUBURN,,,https://petharbor.com/get_image.asp?RES=Detail&LOCATION=KING&ID=A584316,Image Copyright HLP Inc. 2019,"Received on: 2019-05-06<p/> Found Near: 11000 SE 319TH CT AUBURN, WA 98092<p/> Description: Brn Tabby / White Male Domestic Shorthair Cat<p/> Age: 7 WEEKS<p/> Current Location: In RASKC Foster Home <p/>",K19-116983,A584412,Regional Animal Services of King County,FOUND,https://petharbor.com/pet.asp?uaid=KING.A584412,"King County Pet Adoption Center 21615 64TH AVE S KENT, WA 98032",Reggie,Dog,4 YEARS,Neutered Male,Pit Bull,Tan,5/7/19 0:00,Received on,21600 64TH AVE S,KENT,WA,98032,KENT,,,https://petharbor.com/get_image.asp?RES=Detail&LOCATION=KING&ID=A584412,Image Copyright HLP Inc. 2019,"Received on: 2019-05-07<p/> Found Near: 21600 64TH AVE S, KENT WA 98032<p/> Description: Tan Neutered Male Pit Bull Dog<p/> Age: 4 YEARS<p/> Current Location: King County Pet Adoption Center 21615 64TH AVE S KENT, WA 98032<p/>",K19-116992,A584443,Regional Animal Services of King County,FOUND,https://kingcounty.gov/depts/regional-animal-services/about-us/overview.aspx,,,Dead Cat,NO AGE,Unaltered,Domestic Mediumhair,Brn Tabby,5/7/19 0:00,Received on,22100 109TH PL SE,KENT,WA,98031,KENT,,,,Image Copyright HLP Inc. 2019,"Received on: 2019-05-07<p/> Found Near: 22100 109TH PL SE, KENT WA 98031<p/> Description: Brn Tabby Unaltered Domestic Mediumhair Cat<p/> Age: NO AGE<p/>",K19-116990,A556175,Regional Animal Services of King County,FOUND,https://kingcounty.gov/depts/regional-animal-services/about-us/overview.aspx,In RASKC Foster Home,Odin,Cat,2 YEARS,Neutered Male,Domestic Shorthair,Org Tabby,5/7/19 0:00,Received on,30000 45TH PL S,AUBURN,WA,98001,KING COUNTY,,,https://petharbor.com/get_image.asp?RES=Detail&LOCATION=KING&ID=A556175,Image Copyright HLP Inc. 2019,"Received on: 2019-05-07<p/> Found Near: 30000 45TH PL S, AUBURN WA 98001<p/> Description: Org Tabby Neutered Male Domestic Shorthair Cat<p/> Age: 2 YEARS<p/> Current Location: In RASKC Foster Home <p/>",K19-116985,A584415,Regional Animal Services of King County,FOUND,https://kingcounty.gov/depts/regional-animal-services/about-us/overview.aspx,,,Dead Cat,NO AGE,Unaltered,Domestic Longhair,Black / White,5/7/19 0:00,Received on,5200 S 212TH ST,KENT,WA,98032,KENT,,,,Image Copyright HLP Inc. 2019,"Received on: 2019-05-07<p/> Found Near: 5200 S 212TH ST, KENT WA 98032<p/> Description: Black / White Unaltered Domestic Longhair Cat<p/> Age: NO AGE<p/>",K19-116998,A584451,Regional Animal Services of King County,FOUND,https://petharbor.com/pet.asp?uaid=KING.A584451,"King County Pet Adoption Center 21615 64TH AVE S KENT, WA 98032",Karla,Dog,4 YEARS,Spayed Female,St Bernard - Smooth Coated / Mix,White / Tan,5/7/19 0:00,Received on,900 130TH AVE NE,BELLEVUE,WA,98005,BELLEVUE,,,https://petharbor.com/get_image.asp?RES=Detail&LOCATION=KING&ID=A584451,Image Copyright HLP Inc. 2019,"Received on: 2019-05-07<p/> Found Near: 900 130TH AVE NE, BELLEVUE WA 98005<p/> Description: White / Tan Spayed Female St Bernard - Smooth Coated / Mix Dog<p/> Age: 4 YEARS<p/> Current Location: King County Pet Adoption Center 21615 64TH AVE S KENT, WA 98032<p/>",BLUEK19-117014,A584497,Regional Animal Services of King County,ADOPTABLE,https://petharbor.com/pet.asp?uaid=KING.A584497,"King County Pet Adoption Center 21615 64TH AVE S KENT, WA 98032",Charlene,Cat,6 MONTHS,Spayed Female,Domestic Longhair,Black / White,5/8/19 0:00,Received on,,,,,,,,https://petharbor.com/get_image.asp?RES=Detail&LOCATION=KING&ID=A584497,Image Copyright HLP Inc. 2019,"Received on: 2019-05-08<p/> Description: Black / White<p/>  Spayed Female Domestic Longhair Cat<p/> Age: 6 MONTHS<p/> Adoption Fee: $30.00<p/> Current Location: King County Pet Adoption Center 21615 64TH AVE S KENT, WA 98032<p/>Hi! My name is Charlene and I am available for adoption.<p/><p/>I was brought in by a good samaritan on May 8, 2019. <p/><p/>Hi there, I'm what you would call an undersocialized kitten. It doesn't mean anything bad it just means when I was wee little one, I was not taught about how nice and awesome people can be to me. I'm very scared at first but once you take the time to show me I can trust you, I will melt in your arms. Although, I'm a fearful kitty, I actually really love to snuggle and purr! I would love to go to a home with one of my siblings or with a younger, confident kitty friend! <p/><p/>My personality color is BLUE. I am a gentle and loving cat who likes to take things slow. I may get nervous in new situations, so I am looking for a family who understands that I might need some time to warm up. Once I get to know you, I will be a very devoted friend!<p/><p/><p/>",BLUEK19-117022,A584518,Regional Animal Services of King County,FOUND,https://petharbor.com/pet.asp?uaid=KING.A584518,"King County Pet Adoption Center 21615 64TH AVE S KENT, WA 98032",Oscar,Cat,4 YEARS,Neutered Male,Domestic Shorthair,Gray,5/8/19 0:00,Received on,12100 SE 84TH PL,NEWCASTLE,WA,98056,NEWCASTLE,,,https://petharbor.com/get_image.asp?RES=Detail&LOCATION=KING&ID=A584518,Image Copyright HLP Inc. 2019,"Received on: 2019-05-08<p/> Found Near: 12100 SE 84TH PL, NEWCASTLE WA 98056<p/> Description: Gray Neutered Male Domestic Shorthair Cat<p/> Age: 4 YEARS<p/> Current Location: King County Pet Adoption Center 21615 64TH AVE S KENT, WA 98032<p/>",K19-117014,A584497,Regional Animal Services of King County,FOUND,https://petharbor.com/pet.asp?uaid=KING.A584497,"King County Pet Adoption Center 21615 64TH AVE S KENT, WA 98032",Charlene,Cat,6 MONTHS,Spayed Female,Domestic Longhair,Black / White,5/8/19 0:00,Received on,14900 SE 270TH PL,KENT,WA,98042,KENT,,,https://petharbor.com/get_image.asp?RES=Detail&LOCATION=KING&ID=A584497,Image Copyright HLP Inc. 2019,"Received on: 2019-05-08<p/> Found Near: 14900 SE 270TH PL, KENT WA 98042<p/> Description: Black / White Spayed Female Domestic Longhair Cat<p/> Age: 6 MONTHS<p/> Current Location: King County Pet Adoption Center 21615 64TH AVE S KENT, WA 98032<p/>",BLUEK19-117024,A584524,Regional Animal Services of King County,FOUND,https://kingcounty.gov/depts/regional-animal-services/about-us/overview.aspx,In RASKC Foster Home,,Cat,2 WEEKS,Male,Domestic Shorthair,Black / White,5/8/19 0:00,Received on,1600 S 96TH ST,SEATTLE,WA,98108,KING COUNTY,,,https://petharbor.com/get_image.asp?RES=Detail&LOCATION=KING&ID=A584524,Image Copyright HLP Inc. 2019,"Received on: 2019-05-08<p/> Found Near: 1600 S 96TH ST, SEATTLE WA 98108<p/> Description: Black / White Male Domestic Shorthair Cat<p/> Age: 2 WEEKS<p/> Current Location: In RASKC Foster Home <p/>",K19-117025,A584525,Regional Animal Services of King County,FOUND,https://kingcounty.gov/depts/regional-animal-services/about-us/overview.aspx,In RASKC Foster Home,,Cat,2 WEEKS,Female,Domestic Shorthair,Brn Tabby / White,5/8/19 0:00,Received on,1600 S 96TH ST,SEATTLE,WA,98108,KING COUNTY,,,https://petharbor.com/get_image.asp?RES=Detail&LOCATION=KING&ID=A584525,Image Copyright HLP Inc. 2019,"Received on: 2019-05-08<p/> Found Near: 1600 S 96TH ST, SEATTLE WA 98108<p/> Description: Brn Tabby / White Female Domestic Shorthair Cat<p/> Age: 2 WEEKS<p/> Current Location: In RASKC Foster Home <p/>",K19-117027,A584530,Regional Animal Services of King County,FOUND,https://kingcounty.gov/depts/regional-animal-services/about-us/overview.aspx,In RASKC Foster Home,,Cat,2 WEEKS,Male,Domestic Shorthair,Brn Tabby / White,5/8/19 0:00,Received on,1600 S 96TH ST,SEATTLE,WA,98108,KING COUNTY,,,https://petharbor.com/get_image.asp?RES=Detail&LOCATION=KING&ID=A584530,Image Copyright HLP Inc. 2019,"Received on: 2019-05-08<p/> Found Near: 1600 S 96TH ST, SEATTLE WA 98108<p/> Description: Brn Tabby / White Male Domestic Shorthair Cat<p/> Age: 2 WEEKS<p/> Current Location: In RASKC Foster Home <p/>",K19-117026,A584527,Regional Animal Services of King County,FOUND,https://kingcounty.gov/depts/regional-animal-services/about-us/overview.aspx,In RASKC Foster Home,,Cat,2 WEEKS,Male,Domestic Shorthair,Brn Tabby / White,5/8/19 0:00,Received on,1600 S 96TH ST,SEATTLE,WA,98108,KING COUNTY,,,https://petharbor.com/get_image.asp?RES=Detail&LOCATION=KING&ID=A584527,Image Copyright HLP Inc. 2019,"Received on: 2019-05-08<p/> Found Near: 1600 S 96TH ST, SEATTLE WA 98108<p/> Description: Brn Tabby / White Male Domestic Shorthair Cat<p/> Age: 2 WEEKS<p/> Current Location: In RASKC Foster Home <p/>",K19-117048,A584603,Regional Animal Services of King County,ADOPTABLE,https://kingcounty.gov/depts/regional-animal-services/about-us/overview.aspx,In RASKC Foster Home,Benji,Dog,3 YEARS 3 MONTHS,Neutered Male,Chihuahua - Smooth Coated / Mix,Tan,5/9/19 0:00,Received on,21615 64TH AVE S,KENT,WA,98032,KING COUNTY,47.407788,-122.255197,https://petharbor.com/get_image.asp?RES=Detail&LOCATION=KING&ID=A584603,Image Copyright HLP Inc. 2019,"Received on: 2019-05-09<p/> Description: Tan Neutered Male Chihuahua - Smooth Coated / Mix Dog<p/> Age: 3 YEARS 3 MONTHS<p/> Adoption Fee: $125.00<p/> Current Location: In RASKC Foster Home <p/>Hi! My name is Benji and I am available for adoption.<p/><p/>I was brought in by my previous owner on May 9, 2019 because they worked long hours and did not have the time to care for them. I lived in a home with Kingston (A458881 mini poodle). My previous owner described me as a friendly and playful. I was blinded when I was 6 months old and having Kingston helps me navigate my world. I am bonded with my friend Kingston. This means that we must be adopted together to the same home. Our combined adoption fee is $250.<p/><p/>I am a very smart dog! I have shown my caregivers that I already know how to ""sit"" and ""come"".<p/><p/>I am an affectionate lovebug who would be thrilled to cuddle up with you at home!<p/><p/>My caregivers have noticed that I seem to do well with other dogs. When meeting dogs in a new home, I would do best with a slow introduction.<p/><p/>My personality color is GREEN.  I am a gentle and loving dog who likes to take things slow.  I may get nervous in new situations, so I am looking for a family who understands that I might take some time to warm up, but I am outgoing and carefree once I get to know you.  I just can't wait to find my forever home!<p/><p/><p/>",GREENK19-117047,A458881,Regional Animal Services of King County,ADOPTABLE,https://kingcounty.gov/depts/regional-animal-services/about-us/overview.aspx,In RASKC Foster Home,Kingston,Dog,6 YEARS 3 MONTHS,Neutered Male,Toy Poodle,Tan,5/9/19 0:00,Received on,21615 64TH AVE S,KENT,WA,98032,KING COUNTY,47.407788,-122.255197,https://petharbor.com/get_image.asp?RES=Detail&LOCATION=KING&ID=A458881,Image Copyright HLP Inc. 2019,"Received on: 2019-05-09<p/> Description: Tan Neutered Male Toy Poodle Dog<p/> Age: 6 YEARS 3 MONTHS<p/> Adoption Fee: $125.00<p/> Current Location: In RASKC Foster Home <p/>Hi! My name is Kingston and I am available for adoption.<p/><p/>I was brought in by my previous owner on May 9, 2019 because they worked long hours and did not have the time to care for them. I lived in a home with Benji (A584603 a chihuahua mix). My previous owner described me as a friendly and playful lovebug. My buddy Benji is blind and he listens for me to help navigate around his environment. I am bonded with my friend Benji. This means that we must be adopted together to the same home. Our combined adoption fee is $250.<p/><p/>I am a very smart dog! I have shown my caregivers that I already know how to ""sit"", ""stay"", ""come"", and ""down"".<p/><p/>I am an affectionate lovebug who would be thrilled to cuddle up with you at home!<p/><p/>My caregivers have noticed that I seem to do well with other dogs. When meeting dogs in a new home, I would do best with a slow introduction.<p/><p/>My personality color is GREEN. I am an adaptable dog who loves to go with the flow! I am outgoing and carefree, and I just can't wait to find my forever home!<p/><p/><p/>",GREENK19-117043,A584597,Regional Animal Services of King County,FOUND,https://petharbor.com/pet.asp?uaid=KING.A584597,"King County Pet Adoption Center 21615 64TH AVE S KENT, WA 98032",Curzon,Cat,3 YEARS,Spayed Female,Domestic Mediumhair,Black / White,5/9/19 0:00,Received on,11900 SE 212TH PL,KENT,WA,98031,KENT,,,https://petharbor.com/get_image.asp?RES=Detail&LOCATION=KING&ID=A584597,Image Copyright HLP Inc. 2019,"Received on: 2019-05-09<p/> Found Near: 11900 SE 212TH PL, KENT WA 98031<p/> Description: Black / White Spayed Female Domestic Mediumhair Cat<p/> Age: 3 YEARS<p/> Current Location: King County Pet Adoption Center 21615 64TH AVE S KENT, WA 98032<p/>",BLUEK19-117038,A584586,Regional Animal Services of King County,FOUND,https://petharbor.com/pet.asp?uaid=KING.A584586,"King County Pet Adoption Center 21615 64TH AVE S KENT, WA 98032",Uhura,Cat,1 YEAR,Female,Domestic Shorthair,Tortie / White,5/9/19 0:00,Received on,3400 S 262ND ST,KENT,WA,98032,KENT,,,https://petharbor.com/get_image.asp?RES=Detail&LOCATION=KING&ID=A584586,Image Copyright HLP Inc. 2019,"Received on: 2019-05-09<p/> Found Near: 3400 S 262ND ST, KENT WA 98032<p/> Description: Tortie / White Female Domestic Shorthair Cat<p/> Age: 1 YEAR<p/> Current Location: King County Pet Adoption Center 21615 64TH AVE S KENT, WA 98032<p/>",K19-117078,A583783,Regional Animal Services of King County,ADOPTABLE,https://petharbor.com/pet.asp?uaid=KING.A583783,"King County Pet Adoption Center 21615 64TH AVE S KENT, WA 98032",Katrina,Cat,1 YEAR,Spayed Female,Domestic Longhair,Black / White,5/10/19 0:00,Received on,,,,,,,,https://petharbor.com/get_image.asp?RES=Detail&LOCATION=KING&ID=A583783,Image Copyright HLP Inc. 2019,"Received on: 2019-05-10<p/> Description: Black / White<p/>  Spayed Female Domestic Longhair Cat<p/> Age: 1 YEAR<p/> Adoption Fee: $30.00<p/> Current Location: King County Pet Adoption Center 21615 64TH AVE S KENT, WA 98032<p/>Hi! My name is Katrina and I am available for adoption.<p/><p/>I was brought in by a good samaritan on April 27th, 2019.<p/><p/>I'm a really sweet gal who just likes to take my time getting to know you. Once we become friends, I'm actually quite snuggly and love to get pets on my head and shoulders. I would probably take my time getting used to my new surroundings and would love to have a slow transition into my new home. <p/><p/>My personality color is BLUE. I am a gentle and loving cat who likes to take things slow. I may get nervous in new situations, so I am looking for a family who understands that I might need some time to warm up. Once I get to know you, I will be a very devoted friend!<p/><p/>",BLUEK19-117063,A584653,Regional Animal Services of King County,FOUND,https://kingcounty.gov/depts/regional-animal-services/about-us/overview.aspx,,,Dead Cat,NO AGE,Female,Domestic Shorthair,Gray,5/10/19 0:00,Received on,11300 AVONDALE RD NE,REDMOND,WA,98052,REDMOND,47.70048,-122.092758,,Image Copyright HLP Inc. 2019,"Received on: 2019-05-10<p/> Found Near: 11300 AVONDALE RD NE, REDMOND WA 98052<p/> Description: Gray Female Domestic Shorthair Cat<p/> Age: NO AGE<p/>",K19-117066,A584656,Regional Animal Services of King County,FOUND,https://petharbor.com/pet.asp?uaid=KING.A584656,"King County Pet Adoption Center 21615 64TH AVE S KENT, WA 98032",Johann,Cat,4 YEARS,Neutered Male,Domestic Mediumhair,Black / White,5/10/19 0:00,Received on,11900 SE 212TH PL,KENT,WA,98031,KENT,,,https://petharbor.com/get_image.asp?RES=Detail&LOCATION=KING&ID=A584656,Image Copyright HLP Inc. 2019,"Received on: 2019-05-10<p/> Found Near: 11900 SE 212TH PL, KENT WA 98031<p/> Description: Black / White Neutered Male Domestic Mediumhair Cat<p/> Age: 4 YEARS<p/> Current Location: King County Pet Adoption Center 21615 64TH AVE S KENT, WA 98032<p/>",K19-117075,A584686,Regional Animal Services of King County,FOUND,https://petharbor.com/pet.asp?uaid=KING.A584686,"King County Pet Adoption Center 21615 64TH AVE S KENT, WA 98032",Curie,Cat,7 WEEKS,Spayed Female,Domestic Shorthair,Brn Tabby / White,5/10/19 0:00,Received on,27500 46TH CT S,AUBURN,WA,98001,KING COUNTY,,,https://petharbor.com/get_image.asp?RES=Detail&LOCATION=KING&ID=A584686,Image Copyright HLP Inc. 2019,"Received on: 2019-05-10<p/> Found Near: 27500 46TH CT S, AUBURN WA 98001<p/> Description: Brn Tabby / White Spayed Female Domestic Shorthair Cat<p/> Age: 7 WEEKS<p/> Current Location: King County Pet Adoption Center 21615 64TH AVE S KENT, WA 98032<p/>",K19-117071,A584662,Regional Animal Services of King County,FOUND,https://kingcounty.gov/depts/regional-animal-services/about-us/overview.aspx,,,Dead Cat,NO AGE,Female,Domestic Shorthair,Black,5/10/19 0:00,Received on,8200 COAL CREEK PKWY SE,NEWCASTLE,WA,98059,NEWCASTLE,,,,Image Copyright HLP Inc. 2019,"Received on: 2019-05-10<p/> Found Near: 8200 COAL CREEK PKWY SE, NEWCASTLE WA 98059<p/> Description: Black Female Domestic Shorthair Cat<p/> Age: NO AGE<p/>",K19-117106,A584727,Regional Animal Services of King County,ADOPTABLE,https://petharbor.com/pet.asp?uaid=KING.A584727,"Tukwila Petco 17200 SOUTHCENTER PKWY 100 TUKWILA, WA 98188",Wyatt,Cat,2 YEARS,Neutered Male,Domestic Mediumhair,Org Tabby / White,5/11/19 0:00,Received on,17200 SOUTHCENTER PKWY 100,TUKWILA,WA,98188,TUKWILA,47.449119,-122.25821,https://petharbor.com/get_image.asp?RES=Detail&LOCATION=KING&ID=A584727,Image Copyright HLP Inc. 2019,"Received on: 2019-05-11<p/> Description: Org Tabby / White<p/>  Neutered Male Domestic Mediumhair Cat<p/> Age: 2 YEARS<p/> Adoption Fee: $30.00<p/> Current Location: Tukwila Petco 17200 SOUTHCENTER PKWY 100 TUKWILA, WA 98188<p/>Hi! My name is Wyatt and I am available for adoption. I was brought in by an Animal Control Officer on May 11, 2019.<p/><p/>I am an affectionate lovebug who would be thrilled to cuddle up with you at home!<p/><p/>I am bonded with my buddy Lizzie, which means we must be adopted together. If you have room in your home and heart for two new friends then we might just be the cats for you! <p/><p/>My personality color is GREEN. I am an adaptable cat who loves to go with the flow! I am outgoing and carefree, and I just can't wait to find my forever home!<p/><p/>Lizzie (A580290) and Wyatt (A584727) are bonded and must be adopted together.<p/>",GREENK19-117102,A580290,Regional Animal Services of King County,ADOPTABLE,https://petharbor.com/pet.asp?uaid=KING.A580290,"Tukwila Petco 17200 SOUTHCENTER PKWY 100 TUKWILA, WA 98188",Lizzie,Cat,1 YEAR,Spayed Female,Domestic Shorthair,Tortie,5/11/19 0:00,Received on,17200 SOUTHCENTER PKWY 100,TUKWILA,WA,98188,TUKWILA,47.449119,-122.25821,https://petharbor.com/get_image.asp?RES=Detail&LOCATION=KING&ID=A580290,Image Copyright HLP Inc. 2019,"Received on: 2019-05-11<p/> Description: Tortie<p/>  Spayed Female Domestic Shorthair Cat<p/> Age: 1 YEAR<p/> Adoption Fee: $30.00<p/> Current Location: Tukwila Petco 17200 SOUTHCENTER PKWY 100 TUKWILA, WA 98188<p/>Hi! My name is Lizzie and I am available for adoption. <p/><p/>I was brought in by an Animal Control Officer on May 11, 2019.<p/><p/>I am a very sweet little lady who loves to cook and make buiscuits! I love sitting on your lap and giving loves as much as I love receiving them! <p/><p/>I am bonded with my buddy Wyatt, which means we must be adopted together. If you have room in your home and heart for two new friends then we might just be the cats for you! <p/><p/>My personality color is GREEN. I am an adaptable cat who loves to go with the flow! I am outgoing and carefree, and I just can't wait to find my forever home!<p/><p/> Lizzie (A580290) and Wyatt (A584727) are bonded and must be adopted together.<p/>",GREENK19-117123,A584772,Regional Animal Services of King County,ADOPTABLE,https://petharbor.com/pet.asp?uaid=KING.A584772,"King County Pet Adoption Center 21615 64TH AVE S KENT, WA 98032",Graham,Cat,7 WEEKS,Neutered Male,Domestic Shorthair,Black / White,5/12/19 0:00,Received on,,,,,,,,https://petharbor.com/get_image.asp?RES=Detail&LOCATION=KING&ID=A584772,Image Copyright HLP Inc. 2019,"Received on: 2019-05-12<p/> Description: Black / White<p/>  Neutered Male Domestic Shorthair Cat<p/> Age: 7 WEEKS<p/> Adoption Fee: $100.00<p/> Current Location: King County Pet Adoption Center 21615 64TH AVE S KENT, WA 98032<p/><p/>",BLUEK19-117124,A584773,Regional Animal Services of King County,ADOPTABLE,https://petharbor.com/pet.asp?uaid=KING.A584773,"King County Pet Adoption Center 21615 64TH AVE S KENT, WA 98032",Xander,Cat,7 WEEKS,Neutered Male,Domestic Shorthair,Brn Tabby,5/12/19 0:00,Received on,,,,,,,,https://petharbor.com/get_image.asp?RES=Detail&LOCATION=KING&ID=A584773,Image Copyright HLP Inc. 2019,"Received on: 2019-05-12<p/> Description: Brn Tabby<p/>  Neutered Male Domestic Shorthair Cat<p/> Age: 7 WEEKS<p/> Adoption Fee: $100.00<p/> Current Location: King County Pet Adoption Center 21615 64TH AVE S KENT, WA 98032<p/><p/>",BLUEK19-117138,A584787,Regional Animal Services of King County,ADOPTABLE,https://petharbor.com/pet.asp?uaid=KING.A584787,"King County Pet Adoption Center 21615 64TH AVE S KENT, WA 98032",Evie,Cat,3 YEARS,Spayed Female,Domestic Shorthair,Brn Tabby / Tortie,5/12/19 0:00,Received on,,,,,,,,https://petharbor.com/get_image.asp?RES=Detail&LOCATION=KING&ID=A584787,Image Copyright HLP Inc. 2019,"Received on: 2019-05-12<p/> Description: Brn Tabby / Tortie<p/>  Spayed Female Domestic Shorthair Cat<p/> Age: 3 YEARS<p/> Adoption Fee: $30.00<p/> Current Location: King County Pet Adoption Center 21615 64TH AVE S KENT, WA 98032<p/>Hi! My name is Evie and I am available for adoption.<p/><p/>I was brought in by my previous owner on [date] because [reason, e.g. they were moving]. I lived in a home with [other cats/dogs, young/older children]. My previous owner described me as [shy, outgoing, loving, playful, etc.].<p/><p/>I was brought in by a good samaritan on 5/12/19.<p/><p/>My personality color is GREEN. I am an adaptable cat who loves to go with the flow! I am outgoing and carefree, and I just can't wait to find my forever home!<p/><p/>I am an affectionate lovebug who would be thrilled to cuddle up with you at home!<p/><p/><p/>",GREENK19-117111,A478075,Regional Animal Services of King County,FOUND,https://kingcounty.gov/depts/regional-animal-services/about-us/overview.aspx,,,Dead Cat,3 YEARS 8 MONTHS,Neutered Male,Domestic Shorthair,Org Tabby,5/12/19 0:00,Received on,14700 25TH AVE NE,SHORELINE,WA,98155,SHORELINE,,,,Image Copyright HLP Inc. 2019,"Received on: 2019-05-12<p/> Found Near: 14700 25TH AVE NE, SHORELINE WA 98155<p/> Description: Org Tabby Neutered Male Domestic Shorthair Cat<p/> Age: 3 YEARS 8 MONTHS<p/>",K19-117126,A584774,Regional Animal Services of King County,FOUND,https://kingcounty.gov/depts/regional-animal-services/about-us/overview.aspx,In RASKC Foster Home,,Cat,4 WEEKS,Female,Domestic Shorthair,Black / White,5/12/19 0:00,Received on,27000 PACIFIC HWY S,KENT,WA,98032,KENT,47.359776,-122.3082,https://petharbor.com/get_image.asp?RES=Detail&LOCATION=KING&ID=A584774,Image Copyright HLP Inc. 2019,"Received on: 2019-05-12<p/> Found Near: 27000 PACIFIC HWY S, KENT WA 98032<p/> Description: Black / White Female Domestic Shorthair Cat<p/> Age: 4 WEEKS<p/> Current Location: In RASKC Foster Home <p/>",K19-117127,A584776,Regional Animal Services of King County,FOUND,https://kingcounty.gov/depts/regional-animal-services/about-us/overview.aspx,In RASKC Foster Home,Marla,Cat,4 WEEKS,Female,Domestic Shorthair,Black / White,5/12/19 0:00,Received on,27000 PACIFIC HWY S,KENT,WA,98032,KENT,47.359776,-122.3082,https://petharbor.com/get_image.asp?RES=Detail&LOCATION=KING&ID=A584776,Image Copyright HLP Inc. 2019,"Received on: 2019-05-12<p/> Found Near: 27000 PACIFIC HWY S, KENT WA 98032<p/> Description: Black / White Female Domestic Shorthair Cat<p/> Age: 4 WEEKS<p/> Current Location: In RASKC Foster Home <p/>",K19-117129,A584778,Regional Animal Services of King County,FOUND,https://kingcounty.gov/depts/regional-animal-services/about-us/overview.aspx,In RASKC Foster Home,,Cat,4 WEEKS,Female,Domestic Shorthair,Seal Pt,5/12/19 0:00,Received on,27000 PACIFIC HWY S,KENT,WA,98032,KENT,47.359776,-122.3082,https://petharbor.com/get_image.asp?RES=Detail&LOCATION=KING&ID=A584778,Image Copyright HLP Inc. 2019,"Received on: 2019-05-12<p/> Found Near: 27000 PACIFIC HWY S, KENT WA 98032<p/> Description: Seal Pt Female Domestic Shorthair Cat<p/> Age: 4 WEEKS<p/> Current Location: In RASKC Foster Home <p/>",K19-117128,A584777,Regional Animal Services of King County,FOUND,https://kingcounty.gov/depts/regional-animal-services/about-us/overview.aspx,In RASKC Foster Home,Sprinkles,Cat,4 WEEKS,Female,Domestic Shorthair,Tortie,5/12/19 0:00,Received on,27000 PACIFIC HWY S,KENT,WA,98032,KENT,47.359776,-122.3082,https://petharbor.com/get_image.asp?RES=Detail&LOCATION=KING&ID=A584777,Image Copyright HLP Inc. 2019,"Received on: 2019-05-12<p/> Found Near: 27000 PACIFIC HWY S, KENT WA 98032<p/> Description: Tortie Female Domestic Shorthair Cat<p/> Age: 4 WEEKS<p/> Current Location: In RASKC Foster Home <p/>",K19-117123,A584772,Regional Animal Services of King County,FOUND,https://petharbor.com/pet.asp?uaid=KING.A584772,"King County Pet Adoption Center 21615 64TH AVE S KENT, WA 98032",Graham,Cat,7 WEEKS,Neutered Male,Domestic Shorthair,Black / White,5/12/19 0:00,Received on,27500 46TH CT S,AUBURN,WA,98001,KING COUNTY,,,https://petharbor.com/get_image.asp?RES=Detail&LOCATION=KING&ID=A584772,Image Copyright HLP Inc. 2019,"Received on: 2019-05-12<p/> Found Near: 27500 46TH CT S, AUBURN WA 98001<p/> Description: Black / White Neutered Male Domestic Shorthair Cat<p/> Age: 7 WEEKS<p/> Current Location: King County Pet Adoption Center 21615 64TH AVE S KENT, WA 98032<p/>",BLUEK19-117124,A584773,Regional Animal Services of King County,FOUND,https://petharbor.com/pet.asp?uaid=KING.A584773,"King County Pet Adoption Center 21615 64TH AVE S KENT, WA 98032",Xander,Cat,7 WEEKS,Neutered Male,Domestic Shorthair,Brn Tabby,5/12/19 0:00,Received on,27500 46TH CT S,AUBURN,WA,98001,KING COUNTY,,,https://petharbor.com/get_image.asp?RES=Detail&LOCATION=KING&ID=A584773,Image Copyright HLP Inc. 2019,"Received on: 2019-05-12<p/> Found Near: 27500 46TH CT S, AUBURN WA 98001<p/> Description: Brn Tabby Neutered Male Domestic Shorthair Cat<p/> Age: 7 WEEKS<p/> Current Location: King County Pet Adoption Center 21615 64TH AVE S KENT, WA 98032<p/>",BLUEK19-117138,A584787,Regional Animal Services of King County,FOUND,https://petharbor.com/pet.asp?uaid=KING.A584787,"King County Pet Adoption Center 21615 64TH AVE S KENT, WA 98032",Evie,Cat,3 YEARS,Spayed Female,Domestic Shorthair,Brn Tabby / Tortie,5/12/19 0:00,Received on,29100 47TH AVE S,AUBURN,WA,98001,KING COUNTY,,,https://petharbor.com/get_image.asp?RES=Detail&LOCATION=KING&ID=A584787,Image Copyright HLP Inc. 2019,"Received on: 2019-05-12<p/> Found Near: 29100 47TH AVE S, AUBURN WA 98001<p/> Description: Brn Tabby / Tortie Spayed Female Domestic Shorthair Cat<p/> Age: 3 YEARS<p/> Current Location: King County Pet Adoption Center 21615 64TH AVE S KENT, WA 98032<p/>",GREENK19-117115,A584762,Regional Animal Services of King County,FOUND,https://kingcounty.gov/depts/regional-animal-services/about-us/overview.aspx,In RASKC Foster Home,,Cat,5 WEEKS,Female,Domestic Mediumhair,Black,5/12/19 0:00,Received on,7900 10TH AVE S,SEATTLE,WA,98108,SEATTLE,47.531779,-122.3192,https://petharbor.com/get_image.asp?RES=Detail&LOCATION=KING&ID=A584762,Image Copyright HLP Inc. 2019,"Received on: 2019-05-12<p/> Found Near: 7900 10TH AVE S, SEATTLE WA 98108<p/> Description: Black Female Domestic Mediumhair Cat<p/> Age: 5 WEEKS<p/> Current Location: In RASKC Foster Home <p/>",K19-117116,A584763,Regional Animal Services of King County,FOUND,https://kingcounty.gov/depts/regional-animal-services/about-us/overview.aspx,In RASKC Foster Home,,Cat,5 WEEKS,Female,Domestic Mediumhair,Black / White,5/12/19 0:00,Received on,7900 10TH AVE S,SEATTLE,WA,98108,SEATTLE,47.531779,-122.3192,https://petharbor.com/get_image.asp?RES=Detail&LOCATION=KING&ID=A584763,Image Copyright HLP Inc. 2019,"Received on: 2019-05-12<p/> Found Near: 7900 10TH AVE S, SEATTLE WA 98108<p/> Description: Black / White Female Domestic Mediumhair Cat<p/> Age: 5 WEEKS<p/> Current Location: In RASKC Foster Home <p/>",K19-117114,A584761,Regional Animal Services of King County,FOUND,https://kingcounty.gov/depts/regional-animal-services/about-us/overview.aspx,In RASKC Foster Home,,Cat,5 WEEKS,Male,Domestic Mediumhair,Black / White,5/12/19 0:00,Received on,7900 10TH AVE S,SEATTLE,WA,98108,SEATTLE,47.531779,-122.3192,https://petharbor.com/get_image.asp?RES=Detail&LOCATION=KING&ID=A584761,Image Copyright HLP Inc. 2019,"Received on: 2019-05-12<p/> Found Near: 7900 10TH AVE S, SEATTLE WA 98108<p/> Description: Black / White Male Domestic Mediumhair Cat<p/> Age: 5 WEEKS<p/> Current Location: In RASKC Foster Home <p/>",K19-117117,A584764,Regional Animal Services of King County,FOUND,https://kingcounty.gov/depts/regional-animal-services/about-us/overview.aspx,In RASKC Foster Home,,Cat,5 WEEKS,Male,Domestic Mediumhair,Black / White,5/12/19 0:00,Received on,7900 10TH AVE S,SEATTLE,WA,98108,SEATTLE,47.531779,-122.3192,https://petharbor.com/get_image.asp?RES=Detail&LOCATION=KING&ID=A584764,Image Copyright HLP Inc. 2019,"Received on: 2019-05-12<p/> Found Near: 7900 10TH AVE S, SEATTLE WA 98108<p/> Description: Black / White Male Domestic Mediumhair Cat<p/> Age: 5 WEEKS<p/> Current Location: In RASKC Foster Home <p/>",K19-117171,A580406,Regional Animal Services of King County,ADOPTABLE,https://petharbor.com/pet.asp?uaid=KING.A580406,"Covington Petco 27111 167TH PL SE COVINGTON, WA 98042",Matilda,Cat,3 YEARS 2 MONTHS,Spayed Female,Domestic Mediumhair,Gray / White,5/13/19 0:00,Received on,27111 167TH PL SE,COVINGTON,WA,98042,COVINGTON,47.358606,-122.118905,https://petharbor.com/get_image.asp?RES=Detail&LOCATION=KING&ID=A580406,Image Copyright HLP Inc. 2019,"Received on: 2019-05-13<p/> Description: Gray / White<p/>  Spayed Female Domestic Mediumhair Cat<p/> Age: 3 YEARS 2 MONTHS<p/> Adoption Fee: $30.00<p/> Current Location: Covington Petco 27111 167TH PL SE COVINGTON, WA 98042<p/>Hi! My name is Matilda and I am available for adoption. I was brought in by a good samaritan on February 28, 2019. <p/><p/>I am the most precious kitty you will ever meet. I LOVE attention and I will accept as much petting as you're willing to offer!  I am a total lovebug and I'm looking for my forever people!<p/><p/>My personality color is GREEN. I am an adaptable cat who loves to go with the flow! I am outgoing and carefree, and I just can't wait to find my forever home!<p/>",K19-117161,A584839,Regional Animal Services of King County,FOUND,https://kingcounty.gov/depts/regional-animal-services/about-us/overview.aspx,,,Dead Cat,8 YEARS,Female,Domestic Longhair,Choc Pt / Black,5/13/19 0:00,Received on,12600 E MARGINAL WAY S,TUKWILA,WA,98168,TUKWILA,,,,Image Copyright HLP Inc. 2019,"Received on: 2019-05-13<p/> Found Near: 12600 E MARGINAL WAY S, TUKWILA WA 98168<p/> Description: Choc Pt / Black Female Domestic Longhair Cat<p/> Age: 8 YEARS<p/>",K19-117149,A584807,Regional Animal Services of King County,FOUND,https://petharbor.com/pet.asp?uaid=KING.A584807,"King County Pet Adoption Center 21615 64TH AVE S KENT, WA 98032",,Cat,5 DAYS,Female,Domestic Shorthair,Calico,5/13/19 0:00,Received on,3400 S 262ND ST,KENT,WA,98032,KENT,,,https://petharbor.com/get_image.asp?RES=Detail&LOCATION=KING&ID=A584807,Image Copyright HLP Inc. 2019,"Received on: 2019-05-13<p/> Found Near: 3400 S 262ND ST, KENT WA 98032<p/> Description: Calico Female Domestic Shorthair Cat<p/> Age: 5 DAYS<p/> Current Location: King County Pet Adoption Center 21615 64TH AVE S KENT, WA 98032<p/>",K19-117150,A584809,Regional Animal Services of King County,FOUND,https://petharbor.com/pet.asp?uaid=KING.A584809,"King County Pet Adoption Center 21615 64TH AVE S KENT, WA 98032",,Cat,5 DAYS,Female,Domestic Shorthair,Dilute Tor / White,5/13/19 0:00,Received on,3400 S 262ND ST,KENT,WA,98032,KENT,,,https://petharbor.com/get_image.asp?RES=Detail&LOCATION=KING&ID=A584809,Image Copyright HLP Inc. 2019,"Received on: 2019-05-13<p/> Found Near: 3400 S 262ND ST, KENT WA 98032<p/> Description: Dilute Tor / White Female Domestic Shorthair Cat<p/> Age: 5 DAYS<p/> Current Location: King County Pet Adoption Center 21615 64TH AVE S KENT, WA 98032<p/>",K19-117151,A584810,Regional Animal Services of King County,FOUND,https://petharbor.com/pet.asp?uaid=KING.A584810,"King County Pet Adoption Center 21615 64TH AVE S KENT, WA 98032",,Cat,5 DAYS,Female,Domestic Shorthair,Org Tabby,5/13/19 0:00,Received on,3400 S 262ND ST,KENT,WA,98032,KENT,,,https://petharbor.com/get_image.asp?RES=Detail&LOCATION=KING&ID=A584810,Image Copyright HLP Inc. 2019,"Received on: 2019-05-13<p/> Found Near: 3400 S 262ND ST, KENT WA 98032<p/> Description: Org Tabby Female Domestic Shorthair Cat<p/> Age: 5 DAYS<p/> Current Location: King County Pet Adoption Center 21615 64TH AVE S KENT, WA 98032<p/>",K19-117152,A584811,Regional Animal Services of King County,FOUND,https://petharbor.com/pet.asp?uaid=KING.A584811,"King County Pet Adoption Center 21615 64TH AVE S KENT, WA 98032",,Cat,5 DAYS,Male,Domestic Shorthair,Org Tabby,5/13/19 0:00,Received on,3400 S 262ND ST,KENT,WA,98032,KENT,,,https://petharbor.com/get_image.asp?RES=Detail&LOCATION=KING&ID=A584811,Image Copyright HLP Inc. 2019,"Received on: 2019-05-13<p/> Found Near: 3400 S 262ND ST, KENT WA 98032<p/> Description: Org Tabby Male Domestic Shorthair Cat<p/> Age: 5 DAYS<p/> Current Location: King County Pet Adoption Center 21615 64TH AVE S KENT, WA 98032<p/>",K19-117157,A584817,Regional Animal Services of King County,FOUND,https://kingcounty.gov/depts/regional-animal-services/about-us/overview.aspx,In RASKC Foster Home,,Dog,4 WEEKS,Male,Chihuahua - Smooth Coated,Brown / Black,5/13/19 0:00,Received on,5900 S 147TH ST,TUKWILA,WA,98168,TUKWILA,47.471778,-122.2592,https://petharbor.com/get_image.asp?RES=Detail&LOCATION=KING&ID=A584817,Image Copyright HLP Inc. 2019,"Received on: 2019-05-13<p/> Found Near: 5900 S 147TH ST, TUKWILA WA 98168<p/> Description: Brown / Black Male Chihuahua - Smooth Coated Dog<p/> Age: 4 WEEKS<p/> Current Location: In RASKC Foster Home <p/>",K19-117153,A584812,Regional Animal Services of King County,FOUND,https://petharbor.com/pet.asp?uaid=KING.A584812,"King County Pet Adoption Center 21615 64TH AVE S KENT, WA 98032",Spencer,Dog,4 YEARS,Neutered Male,Chihuahua - Smooth Coated,Red / White,5/13/19 0:00,Received on,5900 S 147TH ST,TUKWILA,WA,98168,TUKWILA,47.471778,-122.2592,https://petharbor.com/get_image.asp?RES=Detail&LOCATION=KING&ID=A584812,Image Copyright HLP Inc. 2019,"Received on: 2019-05-13<p/> Found Near: 5900 S 147TH ST, TUKWILA WA 98168<p/> Description: Red / White Neutered Male Chihuahua - Smooth Coated Dog<p/> Age: 4 YEARS<p/> Current Location: King County Pet Adoption Center 21615 64TH AVE S KENT, WA 98032<p/>",GREENK19-117156,A584816,Regional Animal Services of King County,FOUND,https://kingcounty.gov/depts/regional-animal-services/about-us/overview.aspx,In RASKC Foster Home,,Dog,4 WEEKS,Male,Chihuahua - Smooth Coated,Tan / White,5/13/19 0:00,Received on,5900 S 147TH ST,TUKWILA,WA,98168,TUKWILA,47.471778,-122.2592,https://petharbor.com/get_image.asp?RES=Detail&LOCATION=KING&ID=A584816,Image Copyright HLP Inc. 2019,"Received on: 2019-05-13<p/> Found Near: 5900 S 147TH ST, TUKWILA WA 98168<p/> Description: Tan / White Male Chihuahua - Smooth Coated Dog<p/>